,source,title_desc,publishedAt,title_desc_sent_1
0,Bloomberg News,"Goldman Sachs now sees U.S. jobless rate peaking at 25%, not 15%. Goldman Sachs Group Inc. economists revised their forecasts to reflect a gloomier outlook for the U.S. labor market, though also the potential for a faster recovery from the coronavirus pandemic.",2020-05-13,-1
1,CBC,"As Suncor ponders Terra Nova's future, N.L. offshore workers worry about their own. Supply and service sector also on edge as business slows, while government pushes for federal help",2020-05-13,-1
2,"{'id': 'fp-bloomberg-news', 'name': 'Bloomberg News From FP'}",Fed’s Jerome Powell warns coronavirus could do lasting damage to economy; policy makers will need to do more. The Fed chair in his speech outlined the worrying scenario posed by mass bankruptcies and unemployment,2020-05-13,-1
3,"{'id': 'fp-bloomberg-news', 'name': 'Bloomberg News From FP'}",Stocks tumble after double whammy of warnings from Fauci and Fed over pandemic economy. Central bank officials cited risk of the potential for massive bankruptcies that could create a lasting scar,2020-05-12,-1
4,CBC,No decision made on Terra Nova oilfield shutdown: Suncor. Premier Dwight Ball says 'offshore industry has undergone tremendous challenges',2020-05-12,0
5,CBC,"Post-secondary schools face rough autumn if pandemic keeps foreign students away. Already strained by COVID-19, institutions could be further challenged by lack of new students",2020-05-07,0
6,CBC,"Trump clarifies that coronavirus task force will 'continue on indefinitely'. Trump asks Americans to be 'warriors' during pandemic, Pelosi accuses him of having no plan",2020-05-06,0
7,CBC,MRU expands mandatory unpaid leave for employees as COVID crisis continues. We recognize these decisions have significant impacts on employees',2020-04-27,0
8,"{'id': 'fp-bloomberg-news', 'name': 'Bloomberg News From FP'}",Oil price war ends with historic OPEC+ deal for biggest output cut ever of 9.7 million barrels a day. The question now for the oil market is whether the cuts will be enough to throw a floor under prices as demand for energy craters,2020-04-12,0
9,"{'id': 'fp-bloomberg-news', 'name': 'Bloomberg News From FP'}",TSX see biggest weekly gain since 2009 on Fed aid. U.S. stocks posted the biggest weekly gain since 1974,2020-04-09,0
10,CBC,Pretty good for government': Laid-off workers praise ease of COVID-19 emergency benefits site. But laid-off bartender who originally qualified for EI found switch-over to COVID-19 benefit confusing,2020-04-07,0
11,CBC,P.E.I. residents struggle to apply for EI as COVID-19 claims swamp phone lines. ‚Äö√Ñ√≤It‚Äö√Ñ√¥s virtually impossible to reach out to Service Canada at a time when Service Canada is really needed‚Äö√Ñ√¥,2020-04-07,0
12,CBC,"COVID-19 on P.E.I.: What's happening Monday, April 6. 8 of 22 of COVID-19 cases on P.E.I. considered recovered",2020-04-06,0
13,CBC,"Looking for work? These industries are hiring in Toronto during the COVID-19 pandemic. Accounting, e-commerce and IT jobs need to be filled, recruiters say",2020-04-03,1
14,"{'id': 'fp-bloomberg-news', 'name': 'Bloomberg News From FP'}",Stocks suffer weekly loss after dismal jobs report. 'A lot of the bad news is already built into the market',2020-04-02,-1
15,"{'id': 'fp-bloomberg-news', 'name': 'Bloomberg News From FP'}","White House, senators strike deal on America's biggest rescue package ever — $2 trillion in spending and tax breaks. Spending, including direct payments to individuals, dwarfs the $800 billion Obama stimulus that passed five months after the 2008 financial crash",2020-03-25,1
16,CBC,London reeling from the economic impact of COVID-19: deputy mayor. Most downtown businesses are closed and the effect on tourism has been ‚Äö√Ñ√∫devastating‚Äö√Ñ√π,2020-03-25,-1
17,CBC,"Shut down construction sites until COVID-19 threat has passed, says wife of worried worker. Union leader says industry needs to find safe way to continue essential work",2020-03-24,0
18,Bloomberg News,"Canada received over 500,000 EI applications this week. Prime Minister Justin Trudeau said half a million Canadians, or about 2.5 per cent of the labor force, have applied for jobless claims this week, smashing previous records and suggesting the nation is already in a deep recession.",2020-03-20,-1
19,CBC,"PM says closures, social distancing measures could be in place for weeks or months. COVID-19 emergency funds will be flowing in 2 to 3 weeks, government promises",2020-03-19,0
20,CBC,"Kenney heads to Ottawa to demand urgent help from federal Liberals, warning Alberta faces 'triple whammy'. It's time for Ottawa to have Alberta's back'",2020-03-11,-1
21,CBC,"The depths of the despair': CBC Cape Breton explores poverty in Northside communities. I don't think we have conversations about pride and dignity,' says anti-poverty advocate Dorothy Halliday",2020-03-10,0
22,"{'id': 'fp-bloomberg-news', 'name': 'Bloomberg News From FP'}",Fed cuts rate half point over coronavirus in first emergency move since the financial crisis. Decision to cut rates before scheduled meeting reflects the urgency Fed feels to fend off threat of coronavirus,2020-03-03,-1
23,CBC,"A century ago, Winnipeg railways became 'birthplace' of fight for black Canadian workers' rights. Revisiting the struggles, victories of Winnipeg's sleeping car porters during Black History Month",2020-02-29,0
24,CBC,"Personal information belonging to 144,000 Canadians breached by federal departments and agencies. Privacy commissioner's office says it has found 'strong indications of systemic under-reporting'",2020-02-14,0
25,Bloomberg News,"Healthy labour market is providing wage relief in Canada. Canadians have become more confident in the prospect of wage hikes if they leave their job, another sign of health for the country’s labour market.",2020-02-13,1
26,"{'id': 'fp-bloomberg-news', 'name': 'Bloomberg News From FP'}",Condo gains push Canadian housing starts to 4-month high. Could be good news for the nation's increasingly tight real estate markets,2020-02-10,0
27,CBC,"Canada added 35K full-time jobs last month, twice what was expected. Jobless rate ticks down to 5.5 per cent on surge in full-time work",2020-02-08,1
28,CBC,Federal government readies aid for Alberta as deadline for massive oilsands project nears: sources. Ottawa must decide by the end of February if Teck Resources Ltd can build the Frontier mine,2020-02-07,0
29,"{'id': 'fp-bloomberg-news', 'name': 'Bloomberg News From FP'}",Toronto home prices rise at fastest pace in more than two years. Biggest increase since the mortgage stress test was launched,2020-02-06,0
30,CBC,"Aging government computer systems at risk of 'critical failure,' Trudeau warned. IT systems may not be able to handle service improvements promised by Liberals, briefing document says",2020-02-02,0
31,CBC,"P.E.I.'s farm technician program adds high-tech content. It's no different than any other industry, you can fall behind very quickly'",2020-01-29,0
32,"{'id': 'fp-bloomberg-news', 'name': 'Bloomberg News From FP'}","U.S. Federal Reserve leaves main interest rate unchanged, saying policy is appropriate. Continues to signal policy will stay on hold for the time being as the U.S. enters a presidential election year",2020-01-29,0
33,CBC,Grammys CEO says she was ousted after reporting harassment. Lawyers for Deborah Dugan filed a discrimination complaint with the Equal Employment Opportunity Commission,2020-01-24,0
34,CBC,University of Waterloo's RoboHub to be featured in YouTube AI series. RoboHub is a robotics incubator that provides researchers with expertise and equipment,2020-01-24,0
35,CBC,Replacing cheques with pay cards may benefit Ontario Works recipients. About 700 people in the region receive their Ontario Works assistance via cheque,2020-01-17,0
36,CBC,"P.E.I. sees 'tremendous growth' in jobs in 2019. Total number of jobs tops 80,000",2020-01-14,1
37,"{'id': 'fp-bloomberg-news', 'name': 'Bloomberg News From FP'}","Taco Bell is so desperate for workers it's offering $100,000 salaries. Amid an increasingly tough U.S. labour market, the company is betting a higher salary will help it attract workers and keep them on the team",2020-01-09,1
38,"{'id': 'fp-bloomberg-news', 'name': 'Bloomberg News From FP'}","U.S.-China pact signals global trade progress, but Poloz says it’s uncertain if Canada will benefit. Bank of Canada Governor Stephen Poloz said losses from the trade conflict are likely to be permanent even if growth picks up",2020-01-09,-1
39,"{'id': 'fp-bloomberg-news', 'name': 'Bloomberg News From FP'}","Euro Forecasters See a World-Beating Run in 2020. (Bloomberg) — After two years of setbacks, the euro is enjoying a wave of much-needed investor optimism as 2019 draws to a close.",2019-12-27,0
40,CBC,Employees shocked after Athlete Factory suddenly shuts its doors. Dec.¬¨‚Ä†15¬¨‚Ä†we expected to get a paycheque and instead we got an email saying the company is shut down',2019-12-17,-1
41,CBC,New draft ethics guidelines for judges caution them about post-bench work. It will be up to law societies across Canada to give the new rules teeth,2019-12-15,0
42,CBC,"Retirement payments for city workers date back to at least 1964, city clerk says. It was previously thought the payments began in the 1980s",2019-12-14,0
43,CBC,Windsor's unemployment rate third highest in Canada. Canada's unemployment rate is 5.9 per cent,2019-12-06,-1
44,Bloomberg News,"Canada posts largest job loss since 2009 on full-time drop. Canada’s job market unexpectedly weakened for a second-straight month, registering the biggest drop in employment since 2009 and casting doubt on the resiliency of the domestic outlook.",2019-12-06,-1
45,"{'id': 'fp-bloomberg-news', 'name': 'Bloomberg News From FP'}","Canada loses 71,200 jobs in biggest employment drop in decade. Unemployment rate jumps the most since 2009 to 5.9%",2019-12-06,-1
46,CBC,Stella's Circle holds Light Up Hope ceremony for fifth year. When they come to Stella's Circle... they experience hope',2019-12-04,0
47,CBC,"Labour leaders vow to fight bill on essential services in nursing homes. Proposed amendments are a 'direct assault' on collective bargaining rights, they say",2019-11-28,0
48,CBC,Municipal investigator contradicts allegations in Norman Wells lawsuit. Management consultant says SAO being sued by the town was a dedicated employee,2019-11-27,0
49,CBC,Nova Scotia eyes ride sharing to ease rural transportation woes. Province plans to put $250K into ride-sharing projects in up to 3 rural areas,2019-11-19,1
50,"{'id': 'fp-bloomberg-news', 'name': 'Bloomberg News From FP'}","Surge in number of Canadians who can't pay their debts has economists worried — and scratching their heads. Insolvencies are accelerating at a pace that's been associated with periods of distress, yet the economic backdrop has been positive",2019-11-18,0
51,"{'id': 'fp-bloomberg-news', 'name': 'Bloomberg News From FP'}",Alberta loosens oil curbs by exempting new conventional wells in hopes it will spur drilling and create jobs. Allowing more non oilsands output could have an outsized effect on employment without resulting in too much additional output,2019-11-08,1
52,"{'id': 'fp-bloomberg-news', 'name': 'Bloomberg News From FP'}","As Ontario and Quebec see finances improve, Alberta's is only getting worse and it's adding to tensions. Quebec and Ontario have consistently outperformed Alberta during the last four years, but Alberta hasn't received any equalization payments",2019-11-06,0
53,CBC,Scammers spoofing more than a dozen federal government departments to defraud Canadians. It's a new version of a scam that has ripped off thousands of individuals,2019-11-06,0
54,CBC,Sophisticated' fraud scheme tripped by power bill error. Saint John police believe ID thieves from Montreal are part of criminal organization,2019-11-04,0
55,CBC,MLB conducting wider probe of Astros after assistant GM fired. Brandon Taubman directed inappropriate comments at female reporters following team's pennant-clinching win,2019-10-25,0
56,CBC,"Provincial budget cuts could take toll on Edmonton and public sector, critics say. This will protect jobs now and in the future,' finance minister says",2019-10-25,-1
57,CBC,Hospital laundry workers ordered back to work. Walkout deemed illegal by New Brunswick Labour and Employment Board,2019-10-18,0
58,CBC,"Investigation into harassment allegations against Concordia creative writing prof over. Jon Paul Fiorentino no longer works at university, but school won't say if it's connected to findings",2019-10-16,0
59,CBC,Facebook CEO Mark Zuckerberg to appear before Congress on currency plan. Tech giant is under pressure from lawmakers over its massive market power and record of privacy breaches,2019-10-09,0
60,"{'id': 'fp-bloomberg-news', 'name': 'Bloomberg News From FP'}","Jerome Powell says Fed to resume portfolio growth  — but it's not QE. Purchases will made up of Treasury bills, stresses buying should not be seen as return of crisis-era quantitative easing programs",2019-10-08,0
61,"{'id': 'fp-bloomberg-news', 'name': 'Bloomberg News From FP'}","GM strike ripples across the economy, raising new recession fears. The strike has chopped US$400 million in direct wages out of the U.S. economy, with half of that loss coming in Michigan",2019-10-07,-1
62,"{'id': 'fp-bloomberg-news', 'name': 'Bloomberg News From FP'}",Trade conflicts are hitting the global economy with an impact reminiscent of the 1930s. Warning signs mounted today with wave of data showing slumping manufacturing,2019-10-01,-1
63,CBC,"Army reserves looking for recruits at P.E.I. open house. We're always in need of new people as people leave, people retire, people transfer'",2019-09-28,1
64,"{'id': 'fp-bloomberg-news', 'name': 'Bloomberg News From FP'}",'They don't need us anymore': Auto workers are deathly afraid electric cars will eliminate their jobs. Dread over prospect plug-in cars — which have fewer parts and require less labour to build — will doom auto jobs helped spark GM strike,2019-09-27,-1
65,CBC,"NDP leader lands in New Brunswick, says he's sorry for not visiting sooner. Green Party Leader Elizabeth May also in N.B., says it's her third trip this year",2019-09-24,0
66,"{'id': 'fp-bloomberg-news', 'name': 'Bloomberg News From FP'}","Trudeau pledges to cut Canadians’ cellphone bills by 25% within four years. Also promises to raise basic personal income tax deduction, saving average family $585 a year",2019-09-23,0
67,CBC,"2-week turnaround tough bid for outside cod buyers, says Gerry Byrne. FFAW's Keith Sullivan says more communication needed from processors",2019-09-13,0
68,CBC,"Windsor PSW charged with alleged theft from client. Monica Rankin has been charged with theft under $5,000",2019-09-11,0
69,CBC,"City adding more voices to the group advising it on LGBTQ issues. The committee doesn't have enough youth on it, vice chair says, or enough people of colour",2019-09-05,0
70,"{'id': 'fp-bloomberg-news', 'name': 'Bloomberg News From FP'}","If you thought August was bad, get ready for the worst month for Canadian stocks. In the past 10 years, the TSX has dropped an average 1.5% in September",2019-09-03,0
71,"{'id': 'fp-bloomberg-news', 'name': 'Bloomberg News From FP'}",Hudson's Bay selling Lord & Taylor for $100 million to Le Tote. The deal gives HBC a way to divest operations of the struggling chain while holding onto the more valuable asset — the real estate,2019-08-28,0
72,CBC,Whale Tail mine expansion undergoes public hearings this week in Baker Lake. Open pit mine began commercial production this summer,2019-08-27,0
73,"{'id': 'fp-bloomberg-news', 'name': 'Bloomberg News From FP'}","The $30-billion exodus: Foreign oil firms keep bailing on Canada's energy sector. The drumbeat of exits, rare for such a stable oil-producing country, adds an extra layer of gloom for an industry that accounts for about a fifth of Canada's exports",2019-08-22,-1
74,"{'id': 'fp-bloomberg-news', 'name': 'Bloomberg News From FP'}","A Bank of Canada rate cut is looking more likely and the first could come as early as September. A slowing economy and growing trade tensions suggest a cut will happen more quickly than currently accounted for, Macquarie economist says",2019-08-20,-1
75,CBC,Ontario prison farms making a comeback. Federal program shuttered in 2010,2019-08-15,0
76,CBC,Awet Mehari granted bail pending appeal hearing for sexual assault conviction. Survivor says she's frustrated by bail decision,2019-08-13,0
77,CBC,"Ontario wins big in ranking of best place to live in Canada. The best weather? Summerland, BC. The best place to retire is...Toronto",2019-08-12,0
78,CBC,"Unemployment rate jumps to 5.7% in July as more people look for fewer jobs. Canada's economy lost 24,000 jobs last month",2019-08-09,-1
79,"{'id': 'fp-bloomberg-news', 'name': 'Bloomberg News From FP'}","Fed looks locked in for quarter-point cut, but there may be drama. Unclear what signal will emerge about the scope for further easing",2019-07-31,0
80,CBC,"Plastic production could create jobs as mills shut down in B.C. Interior. West Coast Olefins says proposed facility will create up to 1,000 permanent jobs",2019-07-29,1
81,CBC,"Number of Albertans on EI declines as those accessing social assistance increases. Close to 60,000 people are on social assistance in the province",2019-07-18,-1
82,CBC,"Legally blind woman worried she'll lose benefits over father's will. Tanya Smith turned down inheritance to avoid benefits problems, but government lost the paperwork",2019-07-17,0
83,CBC,"Unifor wants urgent meeting to discuss pending layoffs at Bombardier Thunder Bay plant. All parties involved should immediately come to the table to discuss solutions, Jerry Dias says",2019-07-11,-1
84,CBC,"Hundreds of hospital beds shut down across Quebec as staff go on vacation. Health authorities say it's difficult to replace staff during the summer months, but activities are reduced",2019-07-09,0
85,"{'id': 'fp-bloomberg-news', 'name': 'Bloomberg News From FP'}","The world of monetary policy, according to Christine Lagarde. Her views on central-banking issues fall in line with the ECB's — that is, with at least one exception",2019-07-03,0
86,"{'id': 'fp-bloomberg-news', 'name': 'Bloomberg News From FP'}",Christine Lagarde to succeed Mario Draghi as ECB chief just as economy weakens. Lagarde becomes the first woman to run euro-area monetary policy,2019-07-02,-1
87,CBC,"Canada's economy shakes off doldrums, expands 0.3% in April. Pickup in oil and gas extraction in wake of Alberta production cuts helps boost GDP",2019-06-28,1
88,"{'id': 'fp-bloomberg-news', 'name': 'Bloomberg News From FP'}","Biggest refinery on U.S. East Coast set to close after huge explosion, driving up fuel prices. The loss of the refinery will likely increase the region's dependence on supplies from Canada, Europe and the Gulf Coast",2019-06-26,0
89,CBC,"Feds announce $275M for 'largest private sector investment in Canadian history' ‚Äö√Ñ√Æ Kitimat, B.C.'s LNG project. Cash earmarked for energy-efficient gas turbines needed for the $40B project and a new bridge in Kitimat",2019-06-24,1
90,CBC,"Convicted murderer and accomplice of notorious serial killer Allan Legere dead at 52. Scott Michael Curtis was serving life sentence for murder when he died of 'apparent natural causes,' says CSC",2019-06-18,0
91,CBC,"Economic outcomes improving for Indigenous people ‚Äö√Ñ√Æ but not fast enough, report says. Parity between Indigenous, non-Indigenous Canadians won't be reached by 2022 at current pace: NIEDB",2019-06-12,0
92,"{'id': 'fp-bloomberg-news', 'name': 'Bloomberg News From FP'}",'Sea of tranquility': Ontario pitches its debt as a haven to European investors amid Brexit. Finance Minister Vic Fedeli says Ontario is finding investor interest for an eventual deal in Europe,2019-06-11,0
93,"{'id': 'fp-bloomberg-news', 'name': 'Bloomberg News From FP'}",Job surge helps push Canada’s unemployment rate to lowest in over 40 years. Data another sign Canada is on the path back to growth,2019-06-07,1
94,CBC,"Freezing rental assistance while slashing PST misguided, Manitoba anti-poverty group says. Some single adults getting an additional $27 a month while freeze leaves others behind: Make Poverty History",2019-06-05,0
95,CBC,Hiring watchdog to step up monitoring of government job ads. Move comes after some federal departments microtargeted Facebook job ads,2019-05-30,0
96,"{'id': 'fp-bloomberg-news', 'name': 'Bloomberg News From FP'}",Markets are more gloomy about our economy than the Bank of Canada — who’s right?. Some see the loonie falling below 74 cents after the central bank’s rate decision this week,2019-05-27,0
97,"{'id': 'fp-bloomberg-news', 'name': 'Bloomberg News From FP'}","The Bank of Canada is underestimating the housing slump, Capital Economics warns. Developers are having a harder time securing their projects, senior economist says, which will bruise employment and consumption",2019-05-14,-1
98,"{'id': 'fp-bloomberg-news', 'name': 'Bloomberg News From FP'}","Federal Reserve holds interest rate again, reiterates patience on future path. Central bankers, who've been slammed by Trump for not doing more to support the economy, noted livelier growth while acknowledging weak inflation",2019-05-01,1
99,Bloomberg News,"UBS said to tell some managers to only hire when five leave. UBS Group AG is telling executives in its large wealth management business to be more selective when hiring bankers as it seeks to cut costs following a challenging first quarter, according to people familiar with the matter.",2019-04-30,-1
100,Bloomberg News,"U.S. jobless claims rise most since 2017, topping estimates. Filings for U.S. unemployment benefits rose the most since late 2017, while still remaining in the range of what’s considered a tight labor market.",2019-04-25,-1
101,"{'id': 'fp-bloomberg-news', 'name': 'Bloomberg News From FP'}","Canada loses 7,200 jobs, its first employment drop in seven months. Economists had expected a gain",2019-04-05,-1
102,"{'id': 'fp-bloomberg-news', 'name': 'Bloomberg News From FP'}",What gives? Canada’s job market off to its best start in almost 40 years. Aren’t we supposed to be in a slowdown?,2019-03-08,1
103,"{'id': 'fp-bloomberg-news', 'name': 'Bloomberg News From FP'}",Toronto Real Estate Board calls for looser mortgage rules as monthly sales drop most in a year. Realtors warn of ‘hit to the economy’ in the billions of dollars if declines continue,2019-03-05,0
104,"{'id': 'fp-bloomberg-news', 'name': 'Bloomberg News From FP'}","Behind the scenes: What it’s like to work inside Apple’s ‘black site’. Six miles from Apple's dazzling new Cupertino campus is an unidentified, non-descript building that could mirror how some workers are treated",2019-02-12,0
105,"{'id': 'fp-bloomberg-news', 'name': 'Bloomberg News From FP'}","Canada unexpectedly gains almost 67,000 jobs as private-sector hiring hits record. A sign of strength in an economy facing several other headwinds",2019-02-08,1
106,"{'id': 'fp-bloomberg-news', 'name': 'Bloomberg News From FP'}","Canadian expansion on track despite oil, trade headwinds: Morneau. 'Right now, we are continuing to forecast growth this year and for the forecastable future,' Finance Minister says in Davos",2019-01-25,1
107,"{'id': 'fp-bloomberg-news', 'name': 'Bloomberg News From FP'}",The winners and losers of Canada's luxury housing market in 2019. Luxury-home markets across the biggest cities tumbled last year. Here's what Sotheby's expects in 2019,2019-01-09,0
108,"{'id': 'fp-bloomberg-news', 'name': 'Bloomberg News From FP'}","Trump renews attacks on Federal Reserve, calls it the U.S. economy's 'only problem'. U.S. stocks fell back toward their session lows after Trump's outburst, with the S&P 500 Index on track to close at a 19-month low",2018-12-24,0
109,"{'id': 'fp-bloomberg-news', 'name': 'Bloomberg News From FP'}","Fed raises interest rates, turns more cautious on outlook for 2019 hikes. U.S. stocks erased most of their gains after the decision, which struck a slightly less dovish tone than some investors had anticipated",2018-12-19,0
110,"{'id': 'fp-bloomberg-news', 'name': 'Bloomberg News From FP'}","Men on Wall Street are so spooked by the #MeToo movement they're avoiding women at all costs. Wall Street risks becoming more of a boy's club, rather than less of one",2018-12-03,0
111,"{'id': 'fp-bloomberg-news', 'name': 'Bloomberg News From FP'}","Even if OPEC decides to cut, oil prices could still fall in 2019. Opinion: The group is unable to deliver sustainable reductions alone, and geopolitical forces may see other players unwilling to pitch in",2018-11-29,-1
112,"{'id': 'fp-bloomberg-news', 'name': 'Bloomberg News From FP'}",'We're at a crisis and we don't even realize it': The dark side of Toronto's housing boom. Affordable housing is almost impossible to find as tighter mortgage rules and a surge in immigrants has created an all-out war for rentals,2018-11-26,0
113,Bloomberg News,"Canada 6th in the world at attracting talent. Switzerland once again clinched the top spot in a global survey on fostering and attracting talent, in a top 10 list that includes Canada but not the U.S., and no Asian nations.",2018-11-19,1
114,Bloomberg News,"Sears posts job openings with bankruptcy filing ink still wet. Want to join the payroll of a bankrupt retailer this holiday season? Well, has Sears Holdings Corp. got a job for you.",2018-10-15,1
115,Bloomberg News,"Toys ‘R’ Us job carnage drags on July U.S. payroll figures. The toll of one of the largest U.S. retail failures is evident in July employment statistics, which were held back by the collapse of Toys “R” Us.",2018-08-03,-1
