,title_desc,publishedAt,title_desc_sent_1
116,"U.S. economy grew at unrevised 4.2% pace in second quarter. The U.S. economy grew in the second quarter at an unrevised 4.2 per cent pace, the fastest since late 2014, indicating a solid foundation for this quarter, Commerce Department data showed Thursday.",2018-09-27,1
61,"Liberals promises new spending and four more years of deficits, each above $20 billion. That’s despite new revenues including 3% tax on digital giants and luxury tax on $100,000 plus cars and boats",2019-09-30,1
101,"U.S. GDP grows above-forecast 2.6% as business spending picks up. The U.S. economy cooled by less than expected last quarter as business investment picked up, suggesting growth could be stronger for longer as the Federal Reserve takes a patient approach to interest rates.",2019-02-28,1
108,Canada’s economy grows faster than expected. Factories lead fastest economic growth in five months,2018-12-21,1
119,"Canadian economy surges in second quarter on higher exports. Canada’s economy grew at the fastest pace in a year in the second quarter as exports surged, though a slowdown in business investment may cast some clouds over the brighter economic picture.",2018-08-30,1
119,"Canadian economy surges in second quarter on higher exports. Canada’s economy grew at the fastest pace in a year in the second quarter as exports surged, though a slowdown in business investment may cast some clouds over the brighter economic picture.",2018-08-30,1
79,Companies look to cash in on out-of-this-world profits in new space economy. Canadian firms among many investing billions in extraterrestrial ventures,2019-07-17,1
112,"U.S. economy grew at unrevised 3.5% pace in third quarter. The U.S. economy remained on a solid footing in the third quarter, matching previously reported results, as stronger business investment and a bigger boost from inventories cushioned the worst trade drag since 1984.",2018-11-28,1
123,"Trump predicts data will show U.S. economy in ‘terrific’ shape. U.S. President Donald Trump predicted data on Friday will show the U.S. economy is in “terrific” shape amid forecasts that growth topped 4 per cent in the second quarter, the fastest since 2014.",2018-07-27,1
122,"Oil drives Canada's fastest economic growth spurt in a year. Canada’s economy grew at the fastest pace in a year, further evidence of a solid expansion even as trade tensions with the U.S. remain a threat.",2018-07-31,1
116,"U.S. economy grew at unrevised 4.2% pace in second quarter. The U.S. economy grew in the second quarter at an unrevised 4.2 per cent pace, the fastest since late 2014, indicating a solid foundation for this quarter, Commerce Department data showed Thursday.",2018-09-27,1
124,"Trump claims victory as GDP grows at fastest pace since 2014. President Donald Trump said the U.S. economy is on track to reach an annual growth rate of more than 3 per cent, as he celebrated a report Friday that the economy expanded in the second quarter at the fastest pace in four years.",2018-07-27,1
