,description,publishedAt,title,title_desc_sent_1,title_desc
20,"But environmentalists question level of commitment, with bulk of money not allotted until 2nd mandate",2020-03-11,"Quebec government tries to go green in new budget, pushing public transit and electric cars",0,"Quebec government tries to go green in new budget, pushing public transit and electric cars. But environmentalists question level of commitment, with bulk of money not allotted until 2nd mandate"
35,"Belarus relies on Russia for 80% of energy needs, hosts pipeline that Russia uses to export oil",2020-01-03,Russia cuts off oil supplies to Belarus as economic talks collapse,0,"Russia cuts off oil supplies to Belarus as economic talks collapse. Belarus relies on Russia for 80% of energy needs, hosts pipeline that Russia uses to export oil"
59,"All the major federal parties have committed to current levels of funding, but B.C. group wants more",2019-10-05,Stroller brigades' across B.C. make plea for national child-care strategy,0,"Stroller brigades' across B.C. make plea for national child-care strategy. All the major federal parties have committed to current levels of funding, but B.C. group wants more"
29,"U.S. consumer spending moderated and business investment continued to deteriorate at the end of 2019, while a smaller trade deficit and more home construction helped keep economic growth steady.",2020-01-30,Trade helps U.S. economy grow 2.1% while consumption moderates,0,"Trade helps U.S. economy grow 2.1% while consumption moderates. U.S. consumer spending moderated and business investment continued to deteriorate at the end of 2019, while a smaller trade deficit and more home construction helped keep economic growth steady."
2,"Already strained by COVID-19, institutions could be further challenged by lack of new students",2020-05-07,Post-secondary schools face rough autumn if pandemic keeps foreign students away,0,"Post-secondary schools face rough autumn if pandemic keeps foreign students away. Already strained by COVID-19, institutions could be further challenged by lack of new students"
23,"Global Affairs Canada releases study at last minute, compelled by Conservative committee motion",2020-02-27,"New NAFTA beats no NAFTA, gov't says, but no big economic boost coming for Canada",0,"New NAFTA beats no NAFTA, gov't says, but no big economic boost coming for Canada. Global Affairs Canada releases study at last minute, compelled by Conservative committee motion"
91,The bar to change is high,2019-06-04,"The Bank of Canada has learned a few things about targeting inflation, and it's sharing lessons with the Fed",0,"The Bank of Canada has learned a few things about targeting inflation, and it's sharing lessons with the Fed. The bar to change is high"
8,This will help to ensure no product is lost so that farmers are in good position for the 2020 growing season',2020-04-23,P.E.I. announces $4.7M to tackle potato surplus related to COVID-19 market conditions,0,P.E.I. announces $4.7M to tackle potato surplus related to COVID-19 market conditions. This will help to ensure no product is lost so that farmers are in good position for the 2020 growing season'
89,"Local councillor says while project is on schedule, police are ticketing for 'dumb driving behaviour'",2019-06-14,Two more months of traffic pain until CN finishes rail bridge replacement,0,"Two more months of traffic pain until CN finishes rail bridge replacement. Local councillor says while project is on schedule, police are ticketing for 'dumb driving behaviour'"
66,"Patrick Scott, Katrina Nokleby face off for seat vacated by former minister Glen Abernethy",2019-09-17,The candidates: Great Slave,0,"The candidates: Great Slave. Patrick Scott, Katrina Nokleby face off for seat vacated by former minister Glen Abernethy"
75,"This beautiful residence for creatives in Picton, Ont. helps couple build ideal artists' life.",2019-08-09,Why these artists rejected city life (and how they're making it big in their small town),0,"Why these artists rejected city life (and how they're making it big in their small town). This beautiful residence for creatives in Picton, Ont. helps couple build ideal artists' life."
28,"The government may focus on mental health, climate change and housing, says Jennifer Moss",2020-02-09,What a 'well-being budget' could look like in Canada,0,"What a 'well-being budget' could look like in Canada. The government may focus on mental health, climate change and housing, says Jennifer Moss"
90,"Painting the PM as fiscally feckless is a key Conservative argument - but on taxation, it doesn't stand up",2019-06-08,Is Trudeau a 'tax-and-spend' Liberal? The numbers say no,0,"Is Trudeau a 'tax-and-spend' Liberal? The numbers say no. Painting the PM as fiscally feckless is a key Conservative argument - but on taxation, it doesn't stand up"
44,"Trudeau met with Latvian President Egils Levits, Prince Charles earlier Tuesday",2019-12-04,"Canada 'slightly delinquent' on defence spending, Trump says at NATO gathering",0,"Canada 'slightly delinquent' on defence spending, Trump says at NATO gathering. Trudeau met with Latvian President Egils Levits, Prince Charles earlier Tuesday"
29,"U.S. consumer spending moderated and business investment continued to deteriorate at the end of 2019, while a smaller trade deficit and more home construction helped keep economic growth steady.",2020-01-30,Trade helps U.S. economy grow 2.1% while consumption moderates,0,"Trade helps U.S. economy grow 2.1% while consumption moderates. U.S. consumer spending moderated and business investment continued to deteriorate at the end of 2019, while a smaller trade deficit and more home construction helped keep economic growth steady."
43,"There‚Äôs a mismatch between what‚Äôs being built and what renters need, says economist Mark Lee",2019-12-12,"Vancouver needs 10,000 affordable housing units a year to address rental 'backlog,' report advises",0,"Vancouver needs 10,000 affordable housing units a year to address rental 'backlog,' report advises. There‚Äôs a mismatch between what‚Äôs being built and what renters need, says economist Mark Lee"
28,"The government may focus on mental health, climate change and housing, says Jennifer Moss",2020-02-09,What a 'well-being budget' could look like in Canada,0,"What a 'well-being budget' could look like in Canada. The government may focus on mental health, climate change and housing, says Jennifer Moss"
52,"Having escaped an October crash, can we finally talk about irrational markets?",2019-11-11,Lessons from the Great Crash of 1929 for investing in an ever-rising market: Don Pittis,0,"Lessons from the Great Crash of 1929 for investing in an ever-rising market: Don Pittis. Having escaped an October crash, can we finally talk about irrational markets?"
12,"‚ÄòThis is one thing they should take off their list to worry about,‚Äô says Mark Machin",2020-04-06,"Canada Pension Plan board president says the retirement fund is safe, despite economic downturn",0,"Canada Pension Plan board president says the retirement fund is safe, despite economic downturn. ‚ÄòThis is one thing they should take off their list to worry about,‚Äô says Mark Machin"
111,Turmoil in Canada’s two largest export sectors threatens to undermine the country’s so-far-so-good economic expansion.,2018-11-29,Auto and oil woes cast pall over Canada’s economic expansion,0,Auto and oil woes cast pall over Canada’s economic expansion. Turmoil in Canada’s two largest export sectors threatens to undermine the country’s so-far-so-good economic expansion.
23,"Global Affairs Canada releases study at last minute, compelled by Conservative committee motion",2020-02-27,"New NAFTA beats no NAFTA, gov't says, but no big economic boost coming for Canada",0,"New NAFTA beats no NAFTA, gov't says, but no big economic boost coming for Canada. Global Affairs Canada releases study at last minute, compelled by Conservative committee motion"
66,"Patrick Scott, Katrina Nokleby face off for seat vacated by former minister Glen Abernethy",2019-09-17,The candidates: Great Slave,0,"The candidates: Great Slave. Patrick Scott, Katrina Nokleby face off for seat vacated by former minister Glen Abernethy"
117,"China is on course to be the world’s biggest economy by 2030, according to analysis that challenges Donald Trump’s claim that the U.S. is not about to be overtaken.",2018-09-25,"China will overtake the U.S. in less than 15 years, HSBC says",0,"China will overtake the U.S. in less than 15 years, HSBC says. China is on course to be the world’s biggest economy by 2030, according to analysis that challenges Donald Trump’s claim that the U.S. is not about to be overtaken."
92,"With housing and oil off the boil, why hasn't the Canadian economy gone into free fall?",2019-05-31,Why the Canadian economy seems divorced from traditional signals: Don Pittis,0,"Why the Canadian economy seems divorced from traditional signals: Don Pittis. With housing and oil off the boil, why hasn't the Canadian economy gone into free fall?"
43,"There‚Äôs a mismatch between what‚Äôs being built and what renters need, says economist Mark Lee",2019-12-12,"Vancouver needs 10,000 affordable housing units a year to address rental 'backlog,' report advises",0,"Vancouver needs 10,000 affordable housing units a year to address rental 'backlog,' report advises. There‚Äôs a mismatch between what‚Äôs being built and what renters need, says economist Mark Lee"
58,"Still few signs of Canadian recession, but this week's data may tell us more",2019-10-08,All eyes on Canadian jobs numbers as election heads into 5th week: Don Pittis,0,"All eyes on Canadian jobs numbers as election heads into 5th week: Don Pittis. Still few signs of Canadian recession, but this week's data may tell us more"
76,"The Canadian economy expanded for a third-straight month in May on increases in manufacturing and construction, reinforcing the view the central bank can remain on the sidelines for now.",2019-07-31,"Canada's GDP grows 0.2% in May, as manufacturing rebounds",1,"Canada's GDP grows 0.2% in May, as manufacturing rebounds. The Canadian economy expanded for a third-straight month in May on increases in manufacturing and construction, reinforcing the view the central bank can remain on the sidelines for now."
122,"Canada’s economy grew at the fastest pace in a year, further evidence of a solid expansion even as trade tensions with the U.S. remain a threat.",2018-07-31,Oil drives Canada's fastest economic growth spurt in a year,1,"Oil drives Canada's fastest economic growth spurt in a year. Canada’s economy grew at the fastest pace in a year, further evidence of a solid expansion even as trade tensions with the U.S. remain a threat."
119,"Canada’s economy grew at the fastest pace in a year in the second quarter as exports surged, though a slowdown in business investment may cast some clouds over the brighter economic picture.",2018-08-30,Canadian economy surges in second quarter on higher exports,1,"Canadian economy surges in second quarter on higher exports. Canada’s economy grew at the fastest pace in a year in the second quarter as exports surged, though a slowdown in business investment may cast some clouds over the brighter economic picture."
83,"The Conference Board of Canada says outlook rosy for Nunavut and Yukon, but N.W.T. in for a bumpy ride",2019-07-12,Mining boom to drive economic growth in territories beyond rest of Canada: report,1,"Mining boom to drive economic growth in territories beyond rest of Canada: report. The Conference Board of Canada says outlook rosy for Nunavut and Yukon, but N.W.T. in for a bumpy ride"
94,Released figures don't distinguish between cash flow and balance sheet insolvencies and one is worse than the other,2019-05-23,"Canadians' insolvency problems might not be as bad as everyone thinks, C.D. Howe says",1,"Canadians' insolvency problems might not be as bad as everyone thinks, C.D. Howe says. Released figures don't distinguish between cash flow and balance sheet insolvencies and one is worse than the other"
41,"CAQ government honours campaign promise to increase minimum wage over time, working toward $15 per hour",2019-12-18,"Quebec to hike hourly minimum wage by 60 cents, reaching $13.10 on May 1",1,"Quebec to hike hourly minimum wage by 60 cents, reaching $13.10 on May 1. CAQ government honours campaign promise to increase minimum wage over time, working toward $15 per hour"
76,"The Canadian economy expanded for a third-straight month in May on increases in manufacturing and construction, reinforcing the view the central bank can remain on the sidelines for now.",2019-07-31,"Canada's GDP grows 0.2% in May, as manufacturing rebounds",1,"Canada's GDP grows 0.2% in May, as manufacturing rebounds. The Canadian economy expanded for a third-straight month in May on increases in manufacturing and construction, reinforcing the view the central bank can remain on the sidelines for now."
118,"Canada’s measure of real gross domestic product will get a boost after the legalization of marijuana adds as much as $8 billion to the country’s economy, according to Toronto-Dominion Bank.",2018-09-19,"Marijuana to boost Canada's 2019 GDP, at least on paper: TD",1,"Marijuana to boost Canada's 2019 GDP, at least on paper: TD. Canada’s measure of real gross domestic product will get a boost after the legalization of marijuana adds as much as $8 billion to the country’s economy, according to Toronto-Dominion Bank."
79,Canadian firms among many investing billions in extraterrestrial ventures,2019-07-17,Companies look to cash in on out-of-this-world profits in new space economy,1,Companies look to cash in on out-of-this-world profits in new space economy. Canadian firms among many investing billions in extraterrestrial ventures
123,"U.S. President Donald Trump predicted data on Friday will show the U.S. economy is in “terrific” shape amid forecasts that growth topped 4 per cent in the second quarter, the fastest since 2014.",2018-07-27,Trump predicts data will show U.S. economy in ‘terrific’ shape,1,"Trump predicts data will show U.S. economy in ‘terrific’ shape. U.S. President Donald Trump predicted data on Friday will show the U.S. economy is in “terrific” shape amid forecasts that growth topped 4 per cent in the second quarter, the fastest since 2014."
83,"The Conference Board of Canada says outlook rosy for Nunavut and Yukon, but N.W.T. in for a bumpy ride",2019-07-12,Mining boom to drive economic growth in territories beyond rest of Canada: report,1,"Mining boom to drive economic growth in territories beyond rest of Canada: report. The Conference Board of Canada says outlook rosy for Nunavut and Yukon, but N.W.T. in for a bumpy ride"
83,"The Conference Board of Canada says outlook rosy for Nunavut and Yukon, but N.W.T. in for a bumpy ride",2019-07-12,Mining boom to drive economic growth in territories beyond rest of Canada: report,1,"Mining boom to drive economic growth in territories beyond rest of Canada: report. The Conference Board of Canada says outlook rosy for Nunavut and Yukon, but N.W.T. in for a bumpy ride"
107,"Canadian gross domestic product grew at the fastest pace in five months on a lift from manufacturing, giving the economy fresh momentum to open the fourth quarter.",2018-12-21,"Canada's GDP grows at fastest pace in 5 months, boosted by factories",1,"Canada's GDP grows at fastest pace in 5 months, boosted by factories. Canadian gross domestic product grew at the fastest pace in five months on a lift from manufacturing, giving the economy fresh momentum to open the fourth quarter."
41,"CAQ government honours campaign promise to increase minimum wage over time, working toward $15 per hour",2019-12-18,"Quebec to hike hourly minimum wage by 60 cents, reaching $13.10 on May 1",1,"Quebec to hike hourly minimum wage by 60 cents, reaching $13.10 on May 1. CAQ government honours campaign promise to increase minimum wage over time, working toward $15 per hour"
33,"USMCA, Trump’s top legislative priority for the past year, cleared the Senate on an 89-10 vote and now heads to the president for his signature",2020-01-16,"U.S. Senate approves new NAFTA deal, handing Trump a major political win",1,"U.S. Senate approves new NAFTA deal, handing Trump a major political win. USMCA, Trump’s top legislative priority for the past year, cleared the Senate on an 89-10 vote and now heads to the president for his signature"
94,Released figures don't distinguish between cash flow and balance sheet insolvencies and one is worse than the other,2019-05-23,"Canadians' insolvency problems might not be as bad as everyone thinks, C.D. Howe says",1,"Canadians' insolvency problems might not be as bad as everyone thinks, C.D. Howe says. Released figures don't distinguish between cash flow and balance sheet insolvencies and one is worse than the other"
107,"Canadian gross domestic product grew at the fastest pace in five months on a lift from manufacturing, giving the economy fresh momentum to open the fourth quarter.",2018-12-21,"Canada's GDP grows at fastest pace in 5 months, boosted by factories",1,"Canada's GDP grows at fastest pace in 5 months, boosted by factories. Canadian gross domestic product grew at the fastest pace in five months on a lift from manufacturing, giving the economy fresh momentum to open the fourth quarter."
124,"President Donald Trump said the U.S. economy is on track to reach an annual growth rate of more than 3 per cent, as he celebrated a report Friday that the economy expanded in the second quarter at the fastest pace in four years.",2018-07-27,Trump claims victory as GDP grows at fastest pace since 2014,1,"Trump claims victory as GDP grows at fastest pace since 2014. President Donald Trump said the U.S. economy is on track to reach an annual growth rate of more than 3 per cent, as he celebrated a report Friday that the economy expanded in the second quarter at the fastest pace in four years."
57,Kenney government reveals 'ambitious' plan for economic growth,2019-10-25,Alberta looks to private sector and pipelines to deliver better times,1,Alberta looks to private sector and pipelines to deliver better times. Kenney government reveals 'ambitious' plan for economic growth
41,"CAQ government honours campaign promise to increase minimum wage over time, working toward $15 per hour",2019-12-18,"Quebec to hike hourly minimum wage by 60 cents, reaching $13.10 on May 1",1,"Quebec to hike hourly minimum wage by 60 cents, reaching $13.10 on May 1. CAQ government honours campaign promise to increase minimum wage over time, working toward $15 per hour"
113,"Canada’s economy grew for a seventh consecutive month in August, led by crude oil and financial services, keeping the momentum going for higher interest rates.",2018-10-31,Canadian economy expands for seventh month on oil extraction,1,"Canadian economy expands for seventh month on oil extraction. Canada’s economy grew for a seventh consecutive month in August, led by crude oil and financial services, keeping the momentum going for higher interest rates."
107,"Canadian gross domestic product grew at the fastest pace in five months on a lift from manufacturing, giving the economy fresh momentum to open the fourth quarter.",2018-12-21,"Canada's GDP grows at fastest pace in 5 months, boosted by factories",1,"Canada's GDP grows at fastest pace in 5 months, boosted by factories. Canadian gross domestic product grew at the fastest pace in five months on a lift from manufacturing, giving the economy fresh momentum to open the fourth quarter."
112,"The U.S. economy remained on a solid footing in the third quarter, matching previously reported results, as stronger business investment and a bigger boost from inventories cushioned the worst trade drag since 1984.",2018-11-28,U.S. economy grew at unrevised 3.5% pace in third quarter,1,"U.S. economy grew at unrevised 3.5% pace in third quarter. The U.S. economy remained on a solid footing in the third quarter, matching previously reported results, as stronger business investment and a bigger boost from inventories cushioned the worst trade drag since 1984."
34,"China’s economy stabilized last quarter after slowing to the weakest pace in almost three decades, with the first acceleration in investment since June signaling that a firmer recovery could be underway.",2020-01-16,China's economy grew 6% in fourth quarter as demand stabilized,1,"China's economy grew 6% in fourth quarter as demand stabilized. China’s economy stabilized last quarter after slowing to the weakest pace in almost three decades, with the first acceleration in investment since June signaling that a firmer recovery could be underway."
113,"Canada’s economy grew for a seventh consecutive month in August, led by crude oil and financial services, keeping the momentum going for higher interest rates.",2018-10-31,Canadian economy expands for seventh month on oil extraction,1,"Canadian economy expands for seventh month on oil extraction. Canada’s economy grew for a seventh consecutive month in August, led by crude oil and financial services, keeping the momentum going for higher interest rates."
41,"CAQ government honours campaign promise to increase minimum wage over time, working toward $15 per hour",2019-12-18,"Quebec to hike hourly minimum wage by 60 cents, reaching $13.10 on May 1",1,"Quebec to hike hourly minimum wage by 60 cents, reaching $13.10 on May 1. CAQ government honours campaign promise to increase minimum wage over time, working toward $15 per hour"
42,"Update shows deficits for next 5 years, with no sign of a planned return to balance",2019-12-16,"Canada's economy 'sound and growing,' says Morneau as he unveils fiscal update",1,"Canada's economy 'sound and growing,' says Morneau as he unveils fiscal update. Update shows deficits for next 5 years, with no sign of a planned return to balance"
112,"The U.S. economy remained on a solid footing in the third quarter, matching previously reported results, as stronger business investment and a bigger boost from inventories cushioned the worst trade drag since 1984.",2018-11-28,U.S. economy grew at unrevised 3.5% pace in third quarter,1,"U.S. economy grew at unrevised 3.5% pace in third quarter. The U.S. economy remained on a solid footing in the third quarter, matching previously reported results, as stronger business investment and a bigger boost from inventories cushioned the worst trade drag since 1984."
118,"Canada’s measure of real gross domestic product will get a boost after the legalization of marijuana adds as much as $8 billion to the country’s economy, according to Toronto-Dominion Bank.",2018-09-19,"Marijuana to boost Canada's 2019 GDP, at least on paper: TD",1,"Marijuana to boost Canada's 2019 GDP, at least on paper: TD. Canada’s measure of real gross domestic product will get a boost after the legalization of marijuana adds as much as $8 billion to the country’s economy, according to Toronto-Dominion Bank."
57,Kenney government reveals 'ambitious' plan for economic growth,2019-10-25,Alberta looks to private sector and pipelines to deliver better times,1,Alberta looks to private sector and pipelines to deliver better times. Kenney government reveals 'ambitious' plan for economic growth
112,"The U.S. economy remained on a solid footing in the third quarter, matching previously reported results, as stronger business investment and a bigger boost from inventories cushioned the worst trade drag since 1984.",2018-11-28,U.S. economy grew at unrevised 3.5% pace in third quarter,1,"U.S. economy grew at unrevised 3.5% pace in third quarter. The U.S. economy remained on a solid footing in the third quarter, matching previously reported results, as stronger business investment and a bigger boost from inventories cushioned the worst trade drag since 1984."
116,"The U.S. economy grew in the second quarter at an unrevised 4.2 per cent pace, the fastest since late 2014, indicating a solid foundation for this quarter, Commerce Department data showed Thursday.",2018-09-27,U.S. economy grew at unrevised 4.2% pace in second quarter,1,"U.S. economy grew at unrevised 4.2% pace in second quarter. The U.S. economy grew in the second quarter at an unrevised 4.2 per cent pace, the fastest since late 2014, indicating a solid foundation for this quarter, Commerce Department data showed Thursday."
61,"That’s despite new revenues including 3% tax on digital giants and luxury tax on $100,000 plus cars and boats",2019-09-30,"Liberals promises new spending and four more years of deficits, each above $20 billion",1,"Liberals promises new spending and four more years of deficits, each above $20 billion. That’s despite new revenues including 3% tax on digital giants and luxury tax on $100,000 plus cars and boats"
101,"The U.S. economy cooled by less than expected last quarter as business investment picked up, suggesting growth could be stronger for longer as the Federal Reserve takes a patient approach to interest rates.",2019-02-28,U.S. GDP grows above-forecast 2.6% as business spending picks up,1,"U.S. GDP grows above-forecast 2.6% as business spending picks up. The U.S. economy cooled by less than expected last quarter as business investment picked up, suggesting growth could be stronger for longer as the Federal Reserve takes a patient approach to interest rates."
108,Factories lead fastest economic growth in five months,2018-12-21,Canada’s economy grows faster than expected,1,Canada’s economy grows faster than expected. Factories lead fastest economic growth in five months
