title,description
OPINION | Election 2019: A national reckoning on climate change,This campaign offers three different visions for Canada’s future climate change policies,2019-10-16,CBC
How much will the defence file matter to voters?,The Canada Votes newsletter is your weekly tip-sheet as we count down to Oct. 21,2019-07-14,CBC
How troubles with China are becoming an election issue,The Canada Votes newsletter is your weekly tip-sheet as we count down to Oct. 21.,2019-06-09,CBC
"Waterloo candidates surveyed on climate change, cost of living",,2019-10-13,CBC
The candidates: Hay River South,Rocky Simpson challenges Wally Schumann in Hay River South riding,2019-09-19,CBC
The candidates: Yellowknife South,Caroline Wawzonek and Gaeleen McPherson vie for Premier Bob McLeod's former seat,2019-09-17,CBC
"Perth-Wellington candidates on environment, cost of living and top issues in this election",,2019-10-13,CBC
Full transcript of Prime Minister Justin Trudeau's year-end interview with Power & Politics,,2019-12-20,CBC
