"{'id': 'fp-bloomberg-news', 'name': 'Bloomberg News From FP'}",Nate Lanxon,Apple's shock warning: Read the full text of Tim Cook’s letter to shareholders,"Cook sent a letter to investors, dated Jan. 2, to advise them the company was expecting lower revenue than it previously guided",https://business.financialpost.com/technology/apples-shock-warning-read-the-full-text-of-tim-cooks-letter-to-shareholders,https://financialpostcom.files.wordpress.com/2019/01/tim-cook.jpg,"January 3, 2019 9:12 AM EST","Apple Chief Executive Officer Tim Cook sent a letter to investors, dated Jan. 2, to advise them that the company was expecting lower revenue than it previously guided. The full text of the letter as it appears on Apple’s website is below:To Apple investors:Today we are revising our guidance for Apple’s fiscal 2019 first quarter, which ended on December 29. We now expect the following:Revenue of approximately US$84 billion Gross margin of approximately 38 per cent Operating expenses of approximately US$8.7 billion Other income/(expense) of approximately US$550 million Tax rate of approximately 16.5 per cent before discrete items. 
Apple’s warning says a lot about the global economy — and it’s not good
Apple bombshell sends global investors to safe havens while ‘flash crash’ jolts currencies
Apple now says Q1 revenue drop will be up to 10% on weak holiday, China sales
We expect the number of shares used in computing diluted EPS to be approximately 4.77 billion.Based on these estimates, our revenue will be lower than our original guidance for the quarter, with other items remaining broadly in line with our guidance.While it will be a number of weeks before we complete and report our final results, we wanted to get some preliminary information to you now. Our final results may differ somewhat from these preliminary estimates.When we discussed our Q1 guidance with you about 60 days ago, we knew the first quarter would be impacted by both macroeconomic and Apple-specific factors. Based on our best estimates of how these would play out, we predicted that we would report slight revenue growth year-over-year for the quarter. As you may recall, we discussed four factors:First, we knew the different timing of our iPhone launches would affect our year-over-year compares. Our top models, iPhone XS and iPhone XS Max, shipped in Q4’18–placing the channel fill and early sales in that quarter, whereas last year iPhone X shipped in Q1’18, placing the channel fill and early sales in the December quarter. We knew this would create a difficult compare for Q1’19, and this played out broadly in line with our expectations.Second, we knew the strong U.S. dollar would create foreign exchange headwinds and forecasted this would reduce our revenue growth by about 200 basis points as compared to the previous year. This also played out broadly in line with our expectations.Third, we knew we had an unprecedented number of new products to ramp during the quarter and predicted that supply constraints would gate our sales of certain products during Q1. Again, this also played out broadly in line with our expectations. Sales of Apple Watch Series 4 and iPad Pro were constrained much or all of the quarter. AirPods and MacBook Air were also constrained.Fourth, we expected economic weakness in some emerging markets. This turned out to have a significantly greater impact than we had projected.In addition, these and other factors resulted in fewer iPhone upgrades than we had anticipated.These last two points have led us to reduce our revenue guidance. I’d like to go a bit deeper on both.Emerging Market ChallengesWhile we anticipated some challenges in key emerging markets, we did not foresee the magnitude of the economic deceleration, particularly in Greater China. In fact, most of our revenue shortfall to our guidance, and over 100 percent of our year-over-year worldwide revenue decline, occurred in Greater China across iPhone, Mac and iPad.China’s economy began to slow in the second half of 2018. The government-reported GDP growth during the September quarter was the second lowest in the last 25 years. We believe the economic environment in China has been further impacted by rising trade tensions with the United States. As the climate of mounting uncertainty weighed on financial markets, the effects appeared to reach consumers as well, with traffic to our retail stores and our channel partners in China declining as the quarter progressed. And market data has shown that the contraction in Greater China’s smartphone market has been particularly sharp.Despite these challenges, we believe that our business in China has a bright future. The iOS developer community in China is among the most innovative, creative and vibrant in the world. Our products enjoy a strong following among customers, with a very high level of engagement and satisfaction. Our results in China include a new record for Services revenue, and our installed base of devices grew over the last year. We are proud to participate in the Chinese marketplace.iPhoneLower than anticipated iPhone revenue, primarily in Greater China, accounts for all of our revenue shortfall to our guidance and for much more than our entire year-over-year revenue decline. In fact, categories outside of iPhone (Services, Mac, iPad, Wearables/Home/Accessories) combined to grow almost 19 percent year-over-year.While Greater China and other emerging markets accounted for the vast majority of the year-over-year iPhone revenue decline, in some developed markets, iPhone upgrades also were not as strong as we thought they would be. While macroeconomic challenges in some markets were a key contributor to this trend, we believe there are other factors broadly impacting our iPhone performance, including consumers adapting to a world with fewer carrier subsidies, US dollar strength-related price increases, and some customers taking advantage of significantly reduced pricing for iPhone battery replacements.Many Positive Results in the December QuarterWhile it’s disappointing to revise our guidance, our performance in many areas showed remarkable strength in spite of these challenges.Our installed base of active devices hit a new all-time high–growing by more than 100 million units in 12 months. There are more Apple devices being used than ever before, and it’s a testament to the ongoing loyalty, satisfaction and engagement of our customers.Also, as I mentioned earlier, revenue outside of our iPhone business grew by almost 19 percent year-over-year, including all-time record revenue from Services, Wearables and Mac. Our non-iPhone businesses have less exposure to emerging markets, and the vast majority of Services revenue is related to the size of the installed base, not current period sales.Services generated over US$10.8 billion in revenue during the quarter, growing to a new quarterly record in every geographic segment, and we are on track to achieve our goal of doubling the size of this business from 2016 to 2020.Wearables grew by almost 50 per cent year-over-year, as Apple Watch and AirPods were wildly popular among holiday shoppers; launches of MacBook Air and Mac mini powered the Mac to year-over-year revenue growth and the launch of the new iPad Pro drove iPad to year-over-year double-digit revenue growth.We also expect to set all-time revenue records in several developed countries, including the United States, Canada, Germany, Italy, Spain, the Netherlands and Korea. And, while we saw challenges in some emerging markets, others set records, including Mexico, Poland, Malaysia and Vietnam.Finally, we also expect to report a new all-time record for Apple’s earnings per share.Looking AheadOur profitability and cash flow generation are strong, and we expect to exit the quarter with approximately US$130 billion in net cash. As we have stated before, we plan to become net-cash neutral over time.As we exit a challenging quarter, we are as confident as ever in the fundamental strength of our business. We manage Apple for the long term, and Apple has always used periods of adversity to re-examine our approach, to take advantage of our culture of flexibility, adaptability and creativity, and to emerge better as a result.Most importantly, we are confident and excited about our pipeline of future products and services. Apple innovates like no other company on earth, and we are not taking our foot off the gas.We can’t change macroeconomic conditions, but we are undertaking and accelerating other initiatives to improve our results. One such initiative is making it simple to trade in a phone in our stores, finance the purchase over time, and get help transferring data from the current to the new phone. This is not only great for the environment, it is great for the customer, as their existing phone acts as a subsidy for their new phone, and it is great for developers, as it can help grow our installed base.This is one of a number of steps we are taking to respond. We can make these adjustments because Apple’s strength is in our resilience, the talent and creativity of our team, and the deeply held passion for the work we do every day.Expectations are high for Apple because they should be. We are committed to exceeding those expectations every day.That has always been the Apple way, and it always will be.TimBloomberg.com",,-1,US-specific,-1,greater weakness in emerging economies seen esp. China,,,,
"{'id': 'fp-bloomberg-news', 'name': 'Bloomberg News From FP'}",Simon Kennedy,Worried about the world economy? This week we find out just how bad (or good) it really is,"Big week of insights with Fed decision and data from around the world, including Canada",https://business.financialpost.com/news/economy/investors-brace-for-a-big-week-of-insights-into-world-economy,https://financialpostcom.files.wordpress.com/2019/04/earth1.jpg,"April 29, 2019 9:14 AM EDT","The world economy’s ability to rebound from its recent soft patch will be tested anew this week as data is released from Washington to Beijing.Federal Reserve officials conclude a meeting on Wednesday amid expectations they won’t change their monetary policy settings as counterparts elsewhere follow its dovish turn. A press conference by Chairman Jerome Powell will be eyed for insights into his view of the policy outlook as well as what he’s thinking about his inflation target and bond portfolio.“While the Fed is not expected to take any policy action at its May 1 meeting, there will be plenty of action behind the scenes,” said Carl Riccadonna, chief U.S. economist at Bloomberg Economics. 
Canadian exporters continue to struggle even with oil price rally
Bank of Canada holds rate, drops bias for future hikes as economy stalls
Trump hails America’s blockbuster GDP growth — ‘far higher than the high expectations’
Perhaps as interesting will be a flood of data in the aftermath of last week’s news that U.S economic growth accelerated markedly in the first quarter, albeit driven by advances in trade and inventories, which may reverse. The high point will be Friday’s release of the U.S. jobs report for April, with a gain of 180,000 expected by the consensus of economists surveyed by Bloomberg News. A survey of manufacturers on Wednesday is also expected to show some signs of stabilizing.Elsewhere, China releases its purchasing managers index on Tuesday, the same day that the euro-area is predicted to show its economy steadied in the first quarter.Here’s our weekly rundown of key economic events:U.S. and CanadaOther major data due include the U.S. report on personal income and spending on Monday, which is forecast to show spending outpacing income. On Wednesday, the Treasury will reveal its latest plan to keep selling debt to plug a record budget deficit. The U.S. and China will resume trade talks in Beijing amid hopes a deal is imminent. Canada will reveal on Tuesday how its economy performed during the first quarter.Europe, Middle East and AfricaFrance and Italy release output data on Tuesday which, along with the euro-area number, will help provide a more definitive picture of the first quarter, when the European Central Bank became alarmed enough about the slowdown to reactivate its stimulus stance. The modest acceleration seen by economists might provide a basis for policy makers to conclude the current soft patch has stabilized. The Bank of England is set to leave monetary policy unchanged on Thursday, although there is some suggestion it may become more hawkish. The same day, the Czech Republic may hike its benchmark to 2 percent. Turkey’s central bank is due to shed light on billions of dollars of foreign-currency holdings that analysts have been struggling to keep track of this year.AsiaChina’s PMI reports will be closely watched on Tuesday, with economists expecting a further improvement in the factory gauge in April. That would reinforce economists’ recent bet that the worst may be behind the world’s second-biggest economy and that stimulus efforts may be dialled back a notch. Meantime, the next round of China-U.S. trade talks will get under way in Beijing. While analysts have begun to bake in expectations for some form of agreement, global investors are still awaiting a date for President Donald Trump and President Xi Jinping to sign an accord.Latin AmericaMexico’s first quarter gross domestic product, due on Tuesday, will show just how much Latin America’s second-largest economy slowed in the beginning of President Andres Manuel Lopez Obrador’s administration. Also on Tuesday, Argentina’s economic activity may record a slight improvement in February, before slumping again in March as leading indicators suggest. Meanwhile, in Brazil, investors will focus on how much progress President Jair Bolsonaro’s pension overhaul proposal makes in Congress — last week the bill passed the first of seven votes it will have to face before being signed into law.Bloomberg.com",,0,,1,dovish Fed; expects Asian econ improvement,,,,
"{'id': 'fp-bloomberg-news', 'name': 'Bloomberg News From FP'}",Theophilos Argitis,The Toronto Raptors' NBA playoff run helped boost retail sales in Canada in June,"Canadian retail sales beat forecasts in June, keeping the economy on track for what's anticipated to have been a strong second quarter of growth",https://business.financialpost.com/news/economy/the-toronto-raptors-nba-playoff-run-helped-boost-retail-sales-in-canada-in-june,https://financialpostcom.files.wordpress.com/2019/08/raptors.jpg,"August 23, 2019 9:14 AM EDT","Canadian retail sales beat forecasts in June, keeping the economy on track for what’s anticipated to have been a strong second quarter of growth.Receipts for the nation’s retailers were little changed in June, Statistics Canada reported on Friday. Economists were expecting a 0.3 per cent decline.Excluding sales at gasoline stations and car dealerships, retail sales climbed 1.7 per cent, the most since January 2017, aided by the Toronto Raptors’ playoff run.In volume terms, sales were up 0.4 per cent in June, better than what has been typical of late and a stronger-than-expected end to the second quarter. 
Canadian inflation holds steady in July, giving Bank of Canada one less reason to cut rates
Better-than-expected manufacturing data to hold up Canada’s Q2 GDP: Analyst
Canada loses 24,200 jobs in July, pushing unemployment rate higher
Friday’s retail report is the last bit of economic data for the second quarter, with GDP numbers due Aug. 30. The retail numbers are likely to reinforce expectations that second quarter GDP growth was near 3 per cent on an annualized basis, probably enough to keep the central bank on the sidelines for now.“The decent finish to the quarter gives some momentum for Q3, a reason why we see the Bank of Canada delaying a rate cut for several more months,” Avery Shenfeld, chief economist at Canadian Imperial Bank of Commerce said in a note to investors.Even with the flat June results, Canada’s retail sector was able to eke out half decent gains in the second quarter with sales up 1.2 per cent in nominal terms and volumes up 0.1 per cent.Canadian retailers have been in a bit of a slump for more than a year. Volume sales remain below records hit earlier last year. While the second quarter increase in volumes was small, it was the first gain since the third quarter of 2018.Get MoreThe Toronto Raptors playoff run seems to have given a boost to June numbers, helping sales at clothing retailers, sporting goods stores and bars. The Raptors won their first National Basketball Association title in June. Sales of Raptors championship apparel and memorabilia on NBA.com broke the record for the day following a title, topping LeBron James’s 2016 victory with his hometown Cleveland Cavaliers.Receipts at gas stations fell 3.4 per cent, largely on falling prices.Car and parts dealerships recorded a 2.5 per cent decline in sales, mostly on lower volumes.Building materials and gardening equipment gained 6 per cent in June, helped by improving weather during the month.Bloomberg.com",,1,,1,,,,,
"{'id': 'fp-bloomberg-news', 'name': 'Bloomberg News From FP'}",Theophilos Argitis,"Canadian economy expands a stronger-than-expected 3.7%, but it's not all good news",Surprisingly weak household consumption and business investment will cast doubts on the expansion's sustainability,https://business.financialpost.com/news/economy/canadian-economy-expands-3-7-even-as-domestic-demand-shrinks?video_autoplay=true,https://financialpostcom.files.wordpress.com/2019/08/port.jpg,"August 30, 2019 10:36 AM EDT","Canada’s economy recorded a stronger-than-expected rebound in the second quarter as exports recovered, but surprisingly weak consumption and business investment will cast doubts on the expansion’s sustainability.Output grew at an annualized pace of 3.7 per cent in the three months through June, Statistics Canada said Friday in Ottawa, up from a paltry 0.5 per cent increase in the first quarter. The rebound follows two straight quarters of hardly any growth. The period also ended better than expected, with a monthly expansion of 0.2 per cent in June.The underlying details, however, were less impressive. The rebound was driven by the fastest quarterly increase in exports since 2014, but growth in household consumption came to a near halt despite strong gains in incomes, and business investment shrank by the most in more than two years. As a result, domestic demand contracted in the second quarter. 
How some Canadian multinational retail firms are finding ways to get around global trade chaos
‘Where are we going to go?’ U.S. soybeans flooding across border leaving Canadian farmers scrambling
Canadian banks brace for tougher times as ‘Goldilocks’ era winds down
That could be a signal of growing unease among households and businesses about global economic conditions, fuelled by concerns over the U.S.-China trade war and potentially foreshadowing a sharper slowdown in the second half of the year. Policy makers at the Bank of Canada may look through some of the strength in the report.“This was a ‘less than meets the eye’ report,” Brian DePratto, senior economist at Toronto-Dominion Bank, said in a note to investors. “Not only were today’s details weak, but since the second quarter ended we’ve seen yet another escalation in the trade wars and associated uncertainty.”This was a 'less than meets the eye' report Brian DePratto, senior economist at Toronto-Dominion Bank 
 
Possibly reflecting concerns about the outlook, businesses met some of the pickup in foreign demand by drawing down inventories, rather than boosting production. The strong gain in exports, meanwhile, is seen as only temporary, reflecting a ramping up of shipments after a sluggish winter. Exports had slumped sharply earlier this year because of curtailments on oil production and other temporary issues, prompting many businesses to stockpile.DePratto said he expects the Bank of Canada to join the global trend toward easing monetary policy in October, an increasingly likely scenario according to swaps trading. A second cut is being priced in by investors sometime next year. The next rate decision is Sept. 4, when policy makers aren’t expected to move but will likely strike a more dovish tone. Friday’s GDP numbers beat the bank’s 2.3 per cent forecast, and economists had predicted a 3 per cent increase.The stronger-than-expected headline figure boosted the Canadian dollar. The loonie was up 0.2 per cent to $1.3255 per U.S. dollar at 10:04 a.m. in Toronto.‘Solid Increase’Despite the worrying details, the Canadian economic expansion in the second quarter was still impressive — growing the most in two years at easily the fastest pace in the Group of Seven. The U.S. economy expanded by an annualized 2 per cent over the same period.Shipments by Canadian exporters rose at a 13 per cent pace, contributing more than 4 percentage points to growth. A drop in imports also added to the expansion, as more of the nation’s demand was used to buy domestically produced goods and services.Housing investment, meanwhile, recorded its first gain in six quarters.It’s the sort of data that make the case for cheaper money less compelling in Canada than it is elsewhere. Even two cuts over the next 12 months will still leave the country with the highest policy rate among advanced economies.“The solid increase in the headline numbers leaves our call intact for the Bank of Canada to remain patient on cutting rates for the next few month,” said Royce Mendes, an economist at Canadian Imperial Bank of Commerce, which expects a cut in January.Bloomberg.com 



















		( function() {
			var func = function() {
				var iframe_form = document.getElementById('wpcom-iframe-form-978836420e0aaf299fb0dd281c5e89b1-5ebcb3cb7ea4c');
				var iframe = document.getElementById('wpcom-iframe-978836420e0aaf299fb0dd281c5e89b1-5ebcb3cb7ea4c');
				if ( iframe_form && iframe ) {
					iframe_form.submit();
					iframe.onload = function() {
						iframe.contentWindow.postMessage( {
							'msg_type': 'poll_size',
							'frame_id': 'wpcom-iframe-978836420e0aaf299fb0dd281c5e89b1-5ebcb3cb7ea4c'
						}, window.location.protocol + '//wpcomwidgets.com' );
					}
				}

				// Autosize iframe
				var funcSizeResponse = function( e ) {
					var origin = document.createElement( 'a' );
					origin.href = e.origin;

					// Verify message origin
					if ( 'wpcomwidgets.com' !== origin.host )
						return;

					// Verify message is in a format we expect
					if ( 'object' !== typeof e.data || undefined === e.data.msg_type )
						return;

					switch ( e.data.msg_type ) {
						case 'poll_size:response':
							var iframe = document.getElementById( e.data._request.frame_id );

							if ( iframe && '' === iframe.width )
								iframe.width = '100%';
							if ( iframe && '' === iframe.height )
								iframe.height = parseInt( e.data.height );

							return;
						default:
							return;
					}
				}

				if ( 'function' === typeof window.addEventListener ) {
					window.addEventListener( 'message', funcSizeResponse, false );
				} else if ( 'function' === typeof window.attachEvent ) {
					window.attachEvent( 'onmessage', funcSizeResponse );
				}
			}
			if (document.readyState === 'complete') { func.apply(); /* compat for infinite scroll */ }
			else if ( document.addEventListener ) { document.addEventListener( 'readystatechange', function(){ 
if (document.readyState === 'complete') { 
func.apply(); 
} 
},  false ); }
			else if ( document.attachEvent ) { document.attachEvent( 'onreadystatechange', func ); }
		} )();",,-1,description more positive,-1,local demand slows amid trade-war,,,,
