"{'id': 'fp-bloomberg-news', 'name': 'Bloomberg News From FP'}",Theophilos Argitis,Bank of Canada planning thorough review of inflation targeting as post-crisis world exposes flaws in system,BoC's Wilkins says current framework may diminish bank's ability to combat future downturns and encourage households to take on too much debt,https://business.financialpost.com/news/economy/bank-of-canada-plans-thorough-review-of-inflation-targeting,https://financialpostcom.files.wordpress.com/2018/11/bank_of_canada.jpg,"November 20, 2018 1:25 PM EST","The Bank of Canada is preparing the most thorough review of its inflation targeting mandate in three decades to gauge whether it would be better off switching to a new framework, the central bank’s No. 2 official said.In a speech Tuesday in Montreal, Senior Deputy Governor Carolyn Wilkins said the central bank will do a “side-by-side assessment” of alternatives to its inflation targeting regime. That framework is facing a serious challenge from historically low neutral rates, which may diminish the bank’s ability to combat future downturns and encourages households to take on excessive risk.“There is no doubt that our inflation-targeting framework has promoted the economic and financial well-being of Canadians,” Wilkins said in prepared remarks on the Bank of Canada’s preparations ahead of the mandate’s renewal in 2021. “A decade of experience in the post-crisis world, though, shows us it is not perfect. It is time to conduct a thorough review of the alternatives,” she said.Canada’s economic Achilles heel: A mountain of household debtMortgage risks fading as Bank of Canada sees dramatic drop in highly indebted borrowersBanks’ advice to Stephen Poloz: Consider Alberta’s oil woes before plotting your next rate moveThe comments are the strongest indication yet that the central bank will seriously consider changes to a framework that came into effect in the early 1990s and requires the bank to narrowly focus on a single objective: to keep prices stable.2 Per CentOperationally, that means aiming for a 2 per cent inflation target over its so-called forecast horizon of about two years — though some flexibility has been built into the system.The inflation targeting framework and overall focus on price stability — which is widely followed in many advanced economies — has been faulted for helping to fuel the financial imbalances that led to the last global crisis, and also proved to be insufficient in giving economies enough firepower to help recover from the recession.Wilkins pointed out the regime could be challenged in the future by the long-term trend of falling global rates, which means borrowing costs will remain low even after the central bank removes all its stimulus. That will give it less firepower in the event it needs to respond to an economic downturn.Low borrowing costs also mean the economy will continue to be exposed to “booom-bust” financial cycles under inflation targeting, since it encourages households to take on debt.“My bottom line here is that although our inflation-targeting framework has served us very well, we should look for ways to improve it,” Wilkins said.Three CriteriaThe Bank of Canada will use three criteria to assess alternatives: the objectives should be short-term stabilization and cyclical issues rather than long-term matters, they need to support the greater good and consider implications on things like income distribution and financial stability, and they need to be robust in bad times as well as good.Wilkins outlined some of the pros and cons of some alternatives: raising the inflation target, targeting the price level, developing a dual mandate and targeting nominal GDP.The central bank will also need to examine how to improve the clarity around its toolkit of unconventional policies, which will be needed regardless of what framework is in place, Wilkins said. Another question for policy makers, according to Wilkins, is what role is there for fiscal and macroprudential policies to help reduce the burden on monetary policy.–With assistance from Erik Hertzberg.Bloomberg.com",,-1,many post-crisis worries,-1,,,,,
"{'id': 'fp-bloomberg-news', 'name': 'Bloomberg News From FP'}",Alex Tanzi,Global debt-to-GDP ratio has now hit an all-time high of 322%,Debt from all sectors — ranging from household to government to corporate bonds — has surged,https://business.financialpost.com/news/economy/global-debt-to-gdp-ratio-hit-an-all-time-high-last-year?video_autoplay=true,https://financialpostcom.files.wordpress.com/2020/01/debt.jpg,"January 13, 2020 2:01 PM EST","The global debt-to-GDP ratio hit an all-time high of 322 per cent in the third quarter of last year, according to a report released Monday by the Institute of International Finance.Debt rose by almost US$10 trillion to US$252.6 trillion from a year earlier, said the Washington-based IIF, which is comprised of the world’s leading financial institutions. Debt from all sectors — ranging from household to government to corporate bonds — surged.“While borrowing costs remain very low, many countries are finding a debt-driven growth model increasingly difficult to maintain,” said Sonja Gibbs, managing director of global policy initiatives at the institute. “High and rising debt-to-GDP ratios are making debt service and refinancing more challenging, and the 2020s are likely to see a greater incidence of debt distress and restructuring.” 
Rising interest rates and mortgage delinquencies may not go hand in hand — at least in Canada
Saddled with huge levels of debt, Canadians remain fearful a recession is looming
Canadians racked up $100 billion in credit card debt for first time ever and they're not done adding to it
The U.S. general government debt to GDP rose to about 102% of GDP, the IIF said, up 1.6 percentage points from a year earlier. Government debt in China grew at its fastest annual pace since 2009.The institute expects “low interest rates and loose financial conditions,” to push total global debt to exceed US$257 trillion in the first quarter of 2020.Government debt-to-GDP hit a new high in the U.S. and Australia. Household debt-to-GDP reached a record high in Belgium, Finland, France, Lebanon, New Zealand, Nigeria, Norway, Sweden and Switzerland.The IIF noted that a sharp rise in general government debt in Djibouti, Tajikistan, Mongolia Uzbekistan, the Maldives, Kenya and Pakistan is associated with direct loans from China.Emerging market debt grew to US$72.5 trillion from US$66.1 trillion in the third quarter of 2018, according to the IIF, driven in large part by a jump in non-financial corporate borrowing. More than US$19 trillion of syndicated loans and bonds will mature this year, with almost a third of that coming from emerging markets. Bloomberg.com",,-1,debt-driven growth model hard to maintain,-1,,,,,
"{'id': 'fp-bloomberg-news', 'name': 'Bloomberg News From FP'}","Matthew Martin, Alaa Shahine, Layan Odeh and Netty Ismail",Saudi money lost faith in crown prince long before Khashoggi's murder,"Ever since royals and business chiefs were detained as part of a declared crackdown on corruption, rich Saudis have been trying to move money out of the kingdom",https://business.financialpost.com/news/fp-street/saudi-money-lost-faith-in-prince-long-before-khashoggis-murder?video_autoplay=true,https://financialpostcom.files.wordpress.com/2018/11/saudi1.jpg,"November 27, 2018 2:10 PM EST","The murder of Saudi columnist Jamal Khashoggi last month has soured the world’s politicians on the once-feted Crown Prince Mohammed Bin Salman. Private capital turned against him long before that.Ever since dozens of royals and business chiefs were detained in November 2017 as part of a declared crackdown on corruption, a growing number of rich Saudis have been trying to move money out of the kingdom or draw up plans to leave, according to interviews with more than 10 people familiar with the matter. They all spoke on condition of anonymity because the issue is sensitive.Saudis who stayed put are mostly parking their cash instead of increasing investments, adding to the headwinds buffeting the biggest Arab economy. Khashoggi’s killing has only intensified the trends, some of the people said.Penalty for cancelling Saudi arms contract ‘in the billions,’ Trudeau saysIn the shadow of a killing, Saudi Arabia’s investment summit loses its swagger as scrutiny mountsSaudi crown prince’s carefully managed rise hides dark sidePrince Mohammed’s grip on power has survived Khashoggi’s death at the hands of government agents in Istanbul. But losing the confidence of local elites could wreck his most fundamental reform. Saudi wealth is supposed to be building a private sector capable of replacing state oil revenue as the main engine of growth — not staying on the sidelines or trying to flee the country.Even worse, jitters among local capitalists have spread to their foreign counterparts, who are also largely shunning the prince’s project. “A lot of people are afraid of Saudi Arabia,” veteran emerging-market investor Mark Mobius told Bloomberg TV.Watershed MomentThe crackdown, whose targets were detained in the Riyadh Ritz-Carlton hotel, capped a series of steps that had hurt business confidence. Payments owed to contractors were held up, and in June 2017 the kingdom led an unprecedented boycott of neighbouring Qatar.“Domestically, the Ritz arrests were a transformative development — economically and politically,” said Hani Sabra, founder of Alef Advisory, a New York-based consultancy. They were the “crystallization of a process that had been building.”Officials say the arrests were necessary to level the playing field among investors and curb rampant corruption — an argument that resonates with many Saudis who often complained that the elite were above the rule of law. Some of the prince’s supporters also say a short-term decline in investment is an acceptable price to pay for a fundamental overhaul that will help create a more transparent business community.The Saudi central bank, responding to Bloomberg questions, reiterated that the kingdom places “no restrictions on transfers.”But the scale of the purge, which ensnared people like billionaire Prince Alwaleed bin Talal, has left many worried about appearing to be rushing for the exit. To secure their release, detainees agreed to pay settlements that totaled more than US$100 billion. Allegations of torture — denied by the government — and the lack of transparency over settlements made the operation look more like a shakedown.As a result, some Saudis who did subsequently take money out of the country used a web of companies to disguise their ownership, and avoided places with close ties to the kingdom. Many looked to Switzerland or funds elsewhere in Europe, investing in real-estate and private equity funds, some of the people said.“It would be stupid not to make contingency plans,” one Saudi businessman said.One person involved in structuring international deals for Saudis said clients have been shying away from eye-catching purchases. Instead of buying a five-star hotel in London, for example, they would invest the same amount on warehouses in the north of England, the person said.‘Drawing Attention’Money was leaving the country before the purge, partly because the economy slowed as authorities imposed austerity in response to low oil prices, said Steffen Hertog, a Gulf specialist at the London School of Economics. If anything, capital flight probably declined due to the “fear of drawing attention,” he said.Total outflows are estimated to rise 13 per cent this year to US$90 billion, about 10 per cent of GDP, compared with 2017, according to JPMorgan Chase & Co.But such aggregate figures include foreign investments by state institutions. There’s no way to pinpoint how much private Saudi money has been trying to escape a country that’s embarked on aggressive new policies at home and abroad. (On the same day they rounded up business leaders, Saudi authorities are also widely believed to have put Lebanon’s visiting prime minister under effective house arrest.)The purge took place days after global executives attended the prince’s flagship Future Investment Initiative conference at the Ritz-Carlton and lavished praise on his economic plans.After the arrests, some major banks lowered their forecast for loans to businesses, a key gauge of domestic demand. That quarter, private growth slowed sharply — even though oil prices were rebounding.Lagging investment from locals and foreigners, added to new taxes and fees on expats, has helped push unemployment to the highest in more than a decade.‘Off My Map’In an interview the day after Khashoggi disappeared, Prince Mohammed said the jobless rate will start coming down next year. He also predicted a rebound in foreign investment — starting with a sizable non-oil deal to be announced at the FII conference later that month.But then the outcry over Khashoggi began to build, prompting bankers and executives to drop out and turning this year’s event into a subdued affair. The announcement never came.Saudi Arabia will find it hard to attract foreign money because of concerns about the way the country is run, Mobius said in a Bloomberg TV interview in Dubai. “If the leadership has questionable governance, how about the companies?”One regional investor, the head of an Arab family office who’s put money into the kingdom before, said he has no plans to do so again. “Saudi Arabia is off my map now,” he said, asking not to be identified for fear of jeopardizing his existing business.His reasoning is simple. “If I see people taking their money out of Saudi Arabia, despite opportunities there, why should I bring my money?”–With assistance from Donna Abu-Nasr, Jan-Henrik Förster and Archana Narayanan.Bloomberg.com",,0,Saudi-specific,0,,,,,
"{'id': 'fp-bloomberg-news', 'name': 'Bloomberg News From FP'}",Katia Dmitrieva,America’s longest economic expansion is over — and the deepest recession in at least eight decades has begun,"GPD falls 4.8%, consumer spending down most since 1980, business investment plummets to 11-year low",https://business.financialpost.com/news/economy/u-s-economy-shrinks-at-4-8-pace-signaling-start-of-recession,https://financialpostcom.files.wordpress.com/2020/04/recession.jpg,"April 29, 2020 9:25 AM EDT","The record-long U.S. economic expansion is over after almost 11 years, with the deepest recession in at least eight decades now under way. The world’s largest economy shrank at a 4.8 per cent annualized pace in the first quarter, the biggest slide since 2008 and the first contraction since 2014, as the need to fight the coronavirus forced businesses to close and consumers to stay home.The downturn, reported Wednesday by the Commerce Department, was led by the steepest drop in consumer spending since 1980 and the fastest decline in business investment in almost 11 years.The worse-than-expected report reveals the wide-scale hit to U.S. output from COVID-19 and the subsequent freezing of economic activity. The current quarter is likely to be far worse, with analysts expecting the economy to tumble by a record amount in data going back to the 1940s. Bloomberg Economics has projected a 37 per cent annualized contraction, but UniCredit is the most bearish with a 65 per cent estimate.Crisis, RecoveryThat will end an expansion that began in mid-2009 when the economy began to recover from the financial crisis. Since then, gross domestic product swelled by US$7 trillion and unemployment had fallen to a five-decade low of 3.5 per cent, although some have questioned how widely the benefits have been spread with an increasing concentration of wealth at the top and wages rising at a relatively tepid pace for most of the expansion.The pain is being felt worldwide with China already reporting a sharp decline in output and the euro-area set to deliver grim figures Thursday.As the U.S. government and states debate when and how fast to lift restrictions on companies and schools, there remains considerable doubt over the duration of the economic slowdown and the shape of the recovery.Early hopes for a rapid rebound have faded with most analysts assuming a jump in activity once the virus passes will be followed by a slower resumption of growth. So far, many data points signal a deepening contraction, while others have shown slight improvement, according to a Bloomberg Economics tracker.Consumers WaryDespite massive government aid packages and near-zero interest rates, businesses big and small risk going bankrupt, while consumers may remain wary of hitting shops and restaurants amid health concerns, higher debt burdens and job insecurity.Another big question is how the recession affects the re-election chances of President Donald Trump, who lately has been pushing for removal of the constraints after losing the ability to run on a strong economy.At the Federal Reserve, which slashed rates and rolled out a slew of emergency and unprecedented lending programs, Chairman Jerome Powell and colleagues are trying to limit the virus’s damage to jobs and business while setting the conditions for recovery.They conclude a two-day meeting later Wednesday, with a statement expected at 2 p.m. in Washington and a press conference by Powell at 2:30 p.m.While two quarters of contraction is considered by most to constitute a recession, the official call in the U.S. is made by the Business Cycle Dating Committee, a panel of economists at the National Bureau of Economic Research. They look at a wide range of indicators including consumer spending, employment and GDP.The analysis can take a while. In the last recession, which became the longest since World War II, the committee didn’t make the determination for nearly a year after the downturn started.In any case, the GDP figures underscore what’s already clear from government data showing 26 million Americans filing for unemployment, along with plunges in retail sales and factory production.The contraction in first-quarter GDP — the first decline since a 1.1 per cent drop in 2014 — compared with the median projection for a 4 per cent drop in a Bloomberg survey of economists. In January, analysts were forecasting growth of 1.6 per cent.Spending HabitsConsumer spending, which had already begun to cool in the second half of 2019, fell at a 7.6 per cent rate. Changing consumption habits were evident in the report, as the biggest increase since 2003 in spending on nondurable goods such as food was more than offset by the largest slump in purchases of durable goods in more than 11 years.Consumption is forecast to be much weaker in the second quarter because broader government measures including closures of restaurants and stores didn’t start in earnest until mid-to-late March, and they continue today in much of the U.S.Business investment, already down for three straight quarters as the U.S.-China trade war kept companies guessing, also took a big hit. Companies slowed spending on structures and equipment. Investment in software rose, however, potentially reflecting efforts to help employees work from home.Exports of services fell by the most since 1975, reflecting a decline in international travelers coming to the U.S.The first-quarter GDP figures will be revised several times, and some economists broadly expect the reading to become weaker as more data and adjustments are made.Bloomberg.com",,-1,,-1,,,,,
"{'id': 'fp-bloomberg-news', 'name': 'Bloomberg News From FP'}",Greg Quinn,Canada’s economy grows faster than expected,Factories lead fastest economic growth in five months,https://business.financialpost.com/news/economy/factories-lead-canadas-fastest-economic-growth-in-five-months,https://financialpostcom.files.wordpress.com/2018/12/jobs-1.jpg,"December 21, 2018 12:20 PM EST","Canadian gross domestic product grew at the fastest pace in five months on a lift from manufacturing, while oil made an unexpected contribution as prices began to fall for Alberta crude.Output grew 0.3 per cent in October, Statistics Canada said Friday from Ottawa, faster than the median forecast in a Bloomberg economist survey of 0.2 per cent.Factory production expanded 0.7 per cent to make up most of the losses over the prior two months, while wholesaling climbed 1 per cent. The highest volume of trading since March 2016 on Canada’s benchmark stock exchange in Toronto also boosted the finance and insurance industry by 0.9 per cent.Pace of Bank of Canada rate hikes could be interrupted, Stephen Poloz saysStephen Poloz’s dashboard: The latest charts that matter most to the Bank of CanadaThe GDP report is the last one Bank of Canada policy makers will see before they set interest rates and update their quarterly forecasts on Jan. 9. Governor Stephen Poloz has said how soon he adds to his five rate increases since mid-2017 will depend on fresh data, and that he needs to assess the drag from a drop in Alberta oil prices.There wasn’t much direct evidence of an energy slump in the October GDP figures. Oil and gas extraction climbed 3.6 per cent as producers returned sites to service after maintenance shutdowns. The provincial government in Alberta has ordered production cuts in January that could slow growth from here.“The Canadian economy managed to churn out hearty growth overall in October,” Bank of Montreal Chief Economist Doug Porter said in a research note. The economy will expand at a 1.5 per cent annualized pace in the fourth quarter and slow to 1 per cent in the first three months of 2019, with output “particularly challenged” by Alberta’s oil curtailments, he said.The economy’s main weak point in October was the fifth straight decline in construction, which fell 0.1 per cent.The GDP report didn’t include figures on the sale of newly legal marijuana, with Statistics Canada planning to add them in March. A separate report released by the agency Friday on retailing said pot sales totalled $43 million in the two weeks after legalization on Oct. 17.That retail report showed overall sales climbed 0.3 per cent in October, driven by auto dealers and gas stations. That was slower than the median economist forecast for a 0.5 per cent gain.Bloomberg.com",,1,,1,,,,,
"{'id': 'fp-bloomberg-news', 'name': 'Bloomberg News From FP'}",Shelly Hagan,Canada ekes out meagre growth in January before COVID-19 pandemic shut down economy,"Gross domestic product rose 0.1 per cent from December, missing economist estimates for a 0.2 per cent gain",https://business.financialpost.com/news/economy/canada-ekes-out-meager-growth-in-january-before-pandemic?video_autoplay=true,https://financialpostcom.files.wordpress.com/2020/03/economy.jpg,"March 31, 2020 2:15 PM EDT","Canada’s economy expanded less than expected in January even before the pandemic caused a virtual shutdown, reinforcing views the first quarter will be weak.Gross domestic product rose 0.1 per cent from December, missing economist estimates for a 0.2 per cent gain, Statistics Canada reported Tuesday. That follows a 0.3 per cent jump in the prior month.Tuesday’s numbers are largely moot since the growing coronavirus pandemic has changed the entire economic picture in the last month. The weaker-than-expected print backs up economists’ views that the economy will contract in the first quarter. 
‘They are completely intertwined’: Tentative signs of recovery in China help some Canadian companies weather COVID-19 storm
Bank of Canada ventures into uncharted territory to fight coronavirus fallout
Why the coronavirus downturn may be just a recession, not a depression
Key InsightsJanuary’s numbers were slightly affected by the outbreak in China through reduced trade and tourism, Statistics Canada said.Recent monthly GDP numbers do show some signs of recovery from a very weak end to 2019 — with three straight monthly gains between November and January — but that was all before the recent developments.The number will allow economists to fine tune their forecasts for first quarter growth, but expectations are for the quarter to show a contraction.The below-expected January number reinforces those estimates.Bloomberg.com",,-1,less-than-expected,-1,,,,,
