"{'id': 'fp-bloomberg-news', 'name': 'Bloomberg News From FP'}",Reade Pickert and Jeff Kearns,Trump hails America’s blockbuster GDP growth — 'far higher than the high expectations',But underlying demand was weaker than the headline number,https://business.financialpost.com/news/economy/u-s-growth-of-3-2-tops-forecasts-on-trade-inventory-boost,https://financialpostcom.files.wordpress.com/2019/04/trump.jpg,"April 26, 2019 3:11 PM EDT","U.S. economic growth accelerated in the first quarter on a big boost from inventories and trade that offset slowdowns in consumer and business spending, with President Donald Trump touting the report as much stronger than expected.Gross domestic product expanded at a 3.2 per cent annualized rate in the January-March period, according to Commerce Department data Friday that topped all forecasts in a Bloomberg survey calling for 2.3 per cent growth. That followed a 2.2 per cent advance in the prior three months.The numbers may bolster hopes that growth is stabilizing after its recent soft patch. Trump, speaking with reporters before departing on a trip on Air Force One, said the GDP numbers were “far higher than the high expectations.” 
Bank of Canada could resume hikes if data proves slowdown temporary: Poloz
Slump in world trade is just as bad as the decline sparked by the dotcom crash, warn analysts
The IMF cut Canada’s growth outlook — but Deloitte says its forecast is still too optimistic
But underlying demand was weaker than the headline number indicated. Consumer spending, the biggest part of the economy, rose a slightly-above-forecast 1.2 per cent, while business investment cooled. A Federal Reserve-preferred inflation measure, the personal consumption expenditures price index excluding food and energy, slowed to 1.3 per cent, well below policy makers’ 2 per cent objective.Even so, the data showing faster growth and tame inflation helped push Treasury yields lower Friday. U.S. stocks were little changed after paring earlier losses.The first acceleration in GDP since mid-2018 reflected the largest combined boost since 2013 for two typically volatile components — inventories and trade — that could weigh on the economy later in the year. While steady wage gains and the Fed’s forbearance on interest-rate hikes will help make the expansion the nation’s longest on record in July, the fading impact of tax cuts and a global slowdown mean President Donald Trump’s goal of sustained 3 per cent growth will still be difficult to reach.While 3.2 per cent is a “great number,” consumer spending “has to get stronger for the economy to remain in an expansion,” said Michael Gapen, chief U.S. economist at Barclays Plc. “We think it will, but it’s not a silver lining. Underneath the hood, household spending was soft and further expansion is going to require households to get back to a normal space of spending.”What Bloomberg’s Economists Say“While this is encouraging news at face value, particularly given the growth concerns that rattled economic sentiment around the turn of the year, a closer inspection exposes a much more sluggish underlying profile. Much of what made first-quarter GDP look great, will make second-quarter GDP look considerably weaker — namely an unaddressed inventory overhang.” — Carl Riccadonna and Yelena Shulyatyeva, economistsThe growth pickup mainly reflected a downturn in imports, greater state and local government spending, and rising inventories that were partially offset by slower consumer spending and fixed investment, the Commerce Department said in a statement Friday with the GDP data.The pickup in growth came despite the federal government shutdown through most of January, which subtracted 0.3 percentage point from the quarterly growth pace on the reduction in services. Commerce said the closure also chopped the fourth quarter by 0.1 point, while adding that the full effects can’t be quantified.Other recent reports have pointed to signs of strength, with March retail sales rebounding and a proxy for business investment rising sharply. U.S. stocks also rallied the most since 2009 in the first quarter and this month extended gains to a record, easing some concern about the durability of growth.Fed MeetingFed policy makers next week are expected to hold interest rates steady while making adjustments to their characterization of the economy to reflect the firmer data.At the same time, trade tension is fuelling concern about the world economy, with the International Monetary Fund cutting its global growth outlook to the lowest since the financial crisis. Data this week showed world trade volumes falling the most since 2009 in the three months through February, while export-dependent South Korea saw its biggest GDP contraction in a decade.Friday’s report showed net exports added 1.03 percentage point to growth while rising private inventories added 0.65 point. The combined boost of 1.68 point was the biggest in six years.Excluding government and the volatile trade and inventory components, final sales to private domestic purchasers cooled to a 1.3 per cent pace that was the slowest since 2013. Economists monitor this measure for a better sense of underlying demand, especially in a period like the first quarter when rising inventories and a narrower trade deficit propped up GDP.The report showed non-residential business investment rose 2.7 per cent, reflecting the third straight decline in structures and a 0.2 per cent advance for equipment spending that was the weakest since 2016.Residential real estate was a drag on growth for the fifth straight quarter, contracting at a 2.8 per cent annual pace and subtracting 0.11 percentage point from the pace of GDP gains, as housing starts and sales remained relatively sluggish. At the same time, the sector is starting to regain some steam amid lower mortgage rates and more-affordable properties.With assistance from Kristy Scheuble, Sophie Caronello, Shelly Hagan, Alyza Sebenius, Alister Bull and Justin SinkBloomberg.com",,1,,0,growth accelerated,,,,
"{'id': 'fp-bloomberg-news', 'name': 'Bloomberg News From FP'}",Shelly Hagan and Theophilos Argitis,Oil price plunge stokes fears of a recession in Canada,The oil crisis could be the last straw for the Canadian economy,https://business.financialpost.com/news/economy/oil-price-plunge-stokes-fears-of-a-recession-in-canada?video_autoplay=true,https://financialpostcom.files.wordpress.com/2020/03/canadian-flag.jpg,"March 9, 2020 3:58 PM EDT","Economists in Canada are scrambling to revise down their growth forecasts on tumbling oil prices that are stoking fears of a recession.Rising coronavirus concerns prompted economists to start reducing gross domestic product estimates last week. Monday’s plunge in oil prices is sending them back to the drawing board to consider a much more dire situation. The country’s five largest banks will release updated forecasts in the next few days that will show a significantly weaker growth picture.“It’s very possible that Canada in the first half of the year has no growth,” Beata Caranci, chief economist at Toronto-Dominion Bank, said in a phone interview. Besides the shock from lower oil prices, the financial market pressures and confidence impacts from coronavirus are “quite a lot to bear” if sustained, Caranci added. 
Peter Tertzakian: This crude war is about a lot more than oil prices and market share
For Alberta's embattled energy industry, Saudi price war is nothing short of catastrophic
Oil price war tests Canadian energy producers' years-long drive to cut costs
The oil crisis could be the last straw for the Canadian economy which was already on soft footing at the end of 2019, after a drop in exports and business investment resulted in the slowest quarterly pace of growth in three years. Now the oil shock has created more downside risk.Some economists are even flirting with the idea of a recession.It's very possible that Canada in the first half of the year has no growthBeata Caranci, chief economist at Toronto-Dominion Bank 
 
“Given market developments in the last couple of days, the likelihood of a recession has increased dramatically,” Jean-Francois Perrault, chief economist at Bank of Nova Scotia in Toronto, said by phone.As recently as last month, the median forecast in a Bloomberg survey was for growth of 1.6 per cent in 2020 — in line with what the federal government has been projecting in its fiscal outlook. That forecast was slashed last week to about 1 per cent on the back of the fallout from the coronavirus. The impact of this week’s oil shock is set to drive it even lower.Stocks dropped as much as 10 per cent early Monday in Toronto, the loonie weakened and government bond yields plunged as investor pessimism deepened. Canada exported just over $80 billion (US$59 billion) in crude oil and bitumen in 2018, when benchmark oil prices averaged US$57 a barrel. West Texas Intermediate crude for April slumped as much as 34 per cent to US$27.34 a barrel on the New York Mercantile Exchange, before paring losses to 19 per cent.Trudeau’s TurnThe Bank of Canada lowered interest rates last week in an attempt to stimulate growth. The outcome for the economy in 2020 may hinge on what the federal government does to bolster consumer and business confidence.Finance Minister Bill Morneau said last week the government has the tools to shield the economy from the coronavirus crisis, though he stopped short of spelling out specific steps. With the federal budget expected within weeks, Morneau said the government plans to increase the amount it sets aside for emergencies.To be sure, Canada’s oil sector isn’t as large as it used to be, so the impact of lower prices may not be as dramatic. And the industry already underwent a significant adjustment after the rout in crude markets in 2014-15.“Yes, it’s a negative, that’s undeniable, but the footprint of the oil and gas sector is not what it was back then,” Benjamin Reitzes, a macro-strategist at Bank of Montreal, said by phone from Toronto.Still, the combination of headwinds could weaken growth to the point where the pain shows up in the labour market. Given Canada’s elevated levels of household debt, that poses broader risks for the country’s financial system.According to the finance department’s own sensitivity analysis, a one-year, 1 percentage point decline in real GDP would have an annual $5-billion (US$3.69-billion) hit on the government’s bottom line. That would be on top of the near $30-billion deficit already forecast this year from the federal government, even before any new spending measures Prime Minister Justin Trudeau promised during last fall’s election campaign.Markets are already anticipating the Bank of Canada will lower interest rates to levels not seen since the 2008-09 recession. Swaps trading suggests the central bank will lower its policy rate to 0.5 per cent over the next six months, from 1.25 per cent currently.Bloomberg.com",,-1,,-1,,,,,
"{'id': 'fp-bloomberg-news', 'name': 'Bloomberg News From FP'}",Chris Fournier,"Canadians' insolvency problems might not be as bad as everyone thinks, C.D. Howe says",Released figures don't distinguish between cash flow and balance sheet insolvencies and one is worse than the other,https://business.financialpost.com/news/economy/canadians-insolvency-problems-might-not-be-as-bad-as-everyone-thinks-c-d-howe-says,https://financialpostcom.files.wordpress.com/2019/05/empty-wallet.jpg,"May 23, 2019 2:28 PM EDT","The increase in Canadian insolvency filings may be less serious than previously thought, according to one of the country’s top economic research institutions.Consumer insolvencies in Canada rose to the highest in eight years in March. However, it’s difficult to know “how loudly the alarm bell is ringing” because the publicly released figures don’t distinguish between cash flow and balance sheet insolvencies, the C.D. Howe Institute said in a blog posting.Balance sheet insolvency is when a person is still unable to pay off debts, even after selling off all of their assets. Cash flow insolvency, on the other hand, is when a person can’t pay off debts because of difficulties selling their assets. Of the two, balance sheet insolvency is more serious. 
Hold the panic: Maybe Canadians aren’t facing a debt insolvency crisis after all
As bankruptcies rise, BoC’s Poloz says he’s listening to people’s concerns about higher interest rates
More people are going broke in Canada as interest rates rise
“It’s hard to sell your house at a moment’s notice, but that’s really a matter of being illiquid, and not what economists would typically think of as insolvency,” said Jeremy Kronick, associate director of research at C.D. Howe and one of the report’s authors. “There’s a big difference between selling all your assets and still being in debt, versus selling them all and not.”There's a big difference between selling all your assets and still being in debt, versus selling them all and notJeremy Kronick, C.D. Howe 
 
Along with near-record debt-service ratios and rising borrowing costs, rising insolvencies are adding to concern about the sustainability of the country’s lofty household debt levels. To determine how significant the increase in insolvencies is, Kronick argues data at the individual level is needed.No DistinctionThe Ottawa-based Office of the Superintendent of Bankruptcies separates insolvencies into bankruptcies and so-called proposals, when a debtor agrees with creditors to pay off a certain portion of the debt over time. The OSB’s monthly and quarterly reports give the volume of insolvencies, without disclosing liabilities and assets. It discloses those in its annual reports, but aggregated by city and region.“Bankruptcies and consumer proposals include both cash-flow and balance sheet insolvencies,” a spokesman for the OSB said by email. “No distinction is made under the Bankruptcy and Insolvency Act between those two types of insolvencies.”In addition to calling for more detailed insolvency data, the researchers argue some of the warnings about Canada’s rising debt loads may be overstated, given the country’s debt-to-net worth ratio has stayed relatively constant at 20% since 2007, even though debt-to-GDP has risen to 100%, from 75%.“We’re not saying all’s well,” Kronick said. “We’re just trying to say there’s a big difference that we should recognize, but we can’t because we don’t have enough here to tell us.”Bloomberg.com",,1,,1,not as bad as surface number,,,,
"{'id': 'fp-bloomberg-news', 'name': 'Bloomberg News From FP'}",Chris Fournier,Three reasons Canadians will feel the pain of the next recession more than Americans,Signs that financial strains are higher here in Canada,https://business.financialpost.com/news/economy/why-the-next-recession-will-hit-canadians-harder-than-americans?video_autoplay=true,https://financialpostcom.files.wordpress.com/2019/06/toronto-1.jpg,"June 10, 2019 11:41 AM EDT","The recent yield curve inversion has renewed speculation about a potential North American recession and prompted questions about how a contraction would affect households.Though it’s impossible to say for certain when, or even if, such an event will occur, several indicators suggest the pain would be more severe on the Canadian side of the border than in the U.S.Eric Lascelles, chief economist at RBC Global Asset Management Inc., which oversees $430 billion, says while he doesn’t see signs of a debt crisis in the making, Canada’s households are clearly more stretched in terms of debt and spending than their American counterparts. 
Morgan Stanley sees recession within year if trade war gets any worse
The Bank of Canada is very worried about the U.S.-China trade war getting worse, Wilkins says
BoC upbeat about outlook as it leaves rates unchanged, but will proceed with caution
“There’s just no latent capacity to spend or to buffer a shock in Canada, and the U.S. is very well positioned,” Lascelles said by phone from Toronto. “You could lose your job and you would be okay in the U.S., or rates could go up and you’d be fine, or the economy could turn down and spending could continue. In Canada, you can’t really say that.”Here are three indicators that show why financial strains are higher in Canada — and one that shows why the country’s vulnerability to a shock may actually be receding.Canada’s household savings rate fell to 1.1 per cent in the first quarter. “That’s about as low as it gets, historically,” said Lascelles. It compares with 6.7 per cent in the U.S. The disparity between the two rates hasn’t been this wide since the 1970s. The lower the savings rate, the less of a cushion households will have to weather tough economic times.“If there were to be a recession, whether it’s in 2019 or 2029, or sometime in between, you can imagine Canadians getting hit a little harder than Americans,” Lascelles said in a separate webcast. “They just have less room for error, less room to cushion any kind of hit with spending, before they would actually fall into outright dissavings.”Debt-to-Income RatioCanada’s ratio of debt to income reached 176 per cent in the fourth quarter, among the highest in the developed world. That compares with a U.S. rate of 133 per cent. Canada’s households are “substantially more leveraged” than those in the U.S., Lascelles said.Debt Service RatioIn Canada, the debt service ratio — the amount of disposable income that goes to paying interest and principal on debt — climbed to 14.9 per cent in the fourth quarter, the highest since 2007. “It’s about as much money as people have spent servicing debt, on an interest plus a principal basis, since records began in 1990,” Lascelles said. “That’s a concern.”Because the countries measure the DSR differently, finding a direct U.S. comparison is tricky. According to data from the Bank for International Settlements, which applies a common methodology across countries, the debt service ratio of 13.3 per cent in Canada compares with 7.9 per cent in the U.S., another sign Americans have more room to breath should economic conditions deteriorate.On the flip side, Canadian household debt vulnerabilities have improved, Lascelles said, citing an indicator called the Credit-to-GDP gap developed by the BIS. The metric shows how fast credit is rising relative to normal.“It doesn’t look as though an utter disaster is in the offing,” Lascelles said. “The vulnerability seems mostly to do with how quickly the household credit is accumulating, compared to normal. It’s not whether you have a lot of debt, it’s whether you accumulated it recently. In Canada’s case, most of the accumulation was a while ago.”If the housing market implodes — which Lascelles isn’t expecting — it would be the people who got in last who would be most vulnerable, he said, because they would have the lowest equity stake and they would be underwater on their mortgage first. “And so to the extent we haven’t seen credit grow as quickly, there aren’t as many households that are vulnerable.”He added: “It’s not obvious there’s a debt crisis in the making though. It’s just one that’s going to limit consumer spending and limit the economy more generally.”Bloomberg.com",,-1,,-1,,,,,
