title,description,publishedAt,source
New U.S. rule aimed at Huawei's influence focuses on semiconductor suppliers,"Most chip manufacturers rely on equipment produced in U.S., including Apple and Qualcomm supplier",2020-05-15,cbc
U.S. Fed chair rules out negative interest rates even as Trump trumpets them,U.S. president goes negative on Jerome Powell for rejection of below-zero interest rates,2020-05-13,cbc
"As France emerges from 2 gruelling months of isolation, Macron hopes to win back citizens' trust","More than 26,000 people have died of COVID-19 in France",2020-05-10,cbc
'To do it all remotely is pretty impossible:' Campus closings hamper hands-on school programs,"Students need access to labs, gear, co-op jobs to be ready to graduate",2020-04-25,cbc
Shareholder sues Zoom for not disclosing security flaws,Shares down nearly a third of their value since hitting record highs in late March,2020-04-08,cbc
Stock market rally fizzles as oil turns negative again,"TSX, Dow and S&P 500 all up by about three per cent early but gave up gains",2020-04-07,cbc
"Pandemic closures show the value of local farmers, says Wooden Monkey owner","Lil MacPherson, who has closed her well-known Halifax restaurants, says emphasis moving to local food",2020-03-20,cbc
Will COVID-19 affect the spring real estate market?,"Mark Ting, On the Coast's finance columnist, on what you should do if you're looking to buy — or sell",2020-03-15,cbc
"Manitoba promises payroll tax cut for 1,000 employers",Businesses with total salaries below $1.5M will be exempt from the tax as of next year,2020-03-11,cbc
What Alberta job losses in January mean for Edmonton,"Statistics Canada says Alberta lost 19,000 jobs last month ",2020-02-08,cbc
"As China deaths hit 722, WHO warns of global shortage of coronavirus protective equipment","UN agency has been sending testing kits, masks, gloves, respirators and gowns",2020-02-08,cbc
How coronavirus fears could impact your investment portfolio,Finance columnist Mark Ting expects more short term volatility with further drops in the Chinese stock markets,2020-02-02,cbc
"The life-saving medicine she needs is cheap, common and unavailable in Canadian pharmacies",Cassidy Armstrong among a fewer than 200 Canadians who must apply for access,2020-01-30,cbc
"Amid 'astronomical' house prices, councillors push for bigger tax rebate in first-time buyers' pockets","Some warn proposal could curb city revenue stream, push up home prices",2020-01-25,cbc
Ontario Securities Commission chair and CEO Maureen Jensen to step down,Jensen was the first woman to be named chair and CEO of the securities regulator,2020-01-21,cbc
Cineplex agrees to acquisition by U.K.-based Cineworld,"Group offers to pay 42% premium for Canadian theatre chain, subject to shareholder approval",2019-12-16,cbc
Boost for Saudi Arabia as Aramco shares surge 10% on debut,Crown prince trying to diversify economy away from oil,2019-12-11,cbc
Meet The Montreal Children's Library — our CBC charity of 2019,The 90-year-old library was created by 7 women who wanted to boost literacy,2019-12-04,cbc
'This is a crisis': N.W.T. survey shows worsening housing conditions,2019 NWT Community Survey says 42% of all households have at least one major problem,2019-11-29,cbc
North American markets reach new record highs on stronger U.S. economic growth,"In New York, Dow Jones industrial average up 42.32 points to 28,164",2019-11-27,cbc
Why Trump tariffs haven't revitalized American steelmakers,U.S. president's fight against foreign steel overshadowed by trade war with China ,2019-11-05,cbc
Hexo's poor outlook could foreshadow bad trip for cannabis industry,Major Quebec pot producer's revenue well below expectations,2019-10-13,cbc
B.C. seniors face up to 2-month wait for more effective flu vaccine,Fluzone High-Dose vaccine produces a stronger immune response in seniors who are vulnerable to the flu,2019-10-09,cbc
Hong Kong court to hear assault case against student shot by police,18-year-old in stable condition in hospital,2019-10-03,cbc
Peter Mansbridge on the federal election and his new CBC documentary,The veteran CBC News correspondent took calls from Checkup listeners,2019-09-30,cbc
U.S. central bank cuts interest rate again — but split on what to do next,Federal Reserve moving to stimulate economy as trade fears mount,2019-09-18,cbc
What the attack on Saudi oil facilities could mean for Canada's oilpatch and Keystone XL,"'The strike on Saudi refineries should be a wake-up call,' Alberta premier says",2019-09-17,cbc
Cargojet Inc. shares surge on deal with Amazon to grow partnership,The company's shares were up $14.88 at $105.55 in morning trading on the Toronto Stock Exchange,2019-08-23,cbc
Inter Pipeline bid highlights bright spot in Canada's oil sector,Calgary oilsands pipeline firm posted record Q2 net income of $260M last week,2019-08-16,cbc
"Outside buyers allowed in cod market as fishermen protest in St. John's, Old Perlican","If they want the fish at all, buyers will have 14 days to purchase, says fisheries minister",2019-08-12,cbc
5 stylish Canadian yoga wear brands committing to more sustainable practices,These makers are striving for greener production — and not sacrificing on look or feel in the least,2019-07-30,cbc
"Old store, new life: How plants and patterns are reviving a historic St. John's building",The 150-year-old Templeton's building has some new tenants,2019-07-08,cbc
"Germany's Deutsche Bank to cut 18,000 jobs by 2022 in overhaul",Restructuring follows failure in April of merger talks with German rival Commerzbank,2019-07-07,cbc
Oilpatch pushes for construction to start immediately on green-lit Trans Mountain pipeline,"Federal cabinet approved controversial project Tuesday, but hurdles remain",2019-06-18,cbc
"Office buildings turn to apartments, bring downtown Calgary back to life",Calgary and Edmonton's young demographics make it a good fit for creating new rental units,2019-06-18,cbc
N.B. pension management employees score record $5M in bonuses,"Province's investments saw 2% gain last year, despite significant declines in global stock markets ",2019-06-17,cbc
One on One with Markus — Perry Dellelce,Perry Dellelce says his parents always encouraged him to give back,2019-05-29,cbc
A long trade war could threaten Communist Party legitimacy: Don Pittis,Looming U.S. election offers China short-term clout but it faces long-term dangers,2019-05-27,cbc
Canada's energy sector swings to profit in Q1 on higher oil prices,The energy sector's increase in operating profit outpaced all other major Canadian industries,2019-05-24,cbc
